Name_CH,Name_ML,Name_EN,Location,Region,Category,PageNumber,Country
中华函授学校马来西亚同学会,"Persatuan Bekas Murid-AAurid Chung Hwa Taiwan, Malaysia",,"PO Box 236, Jalan Sultan,46720 PJ/77A,Jalan Mega Mendung, Bandar Park, Old Klang Road, 58200 Kuala Lumpur",Selangor,文教,214,Malaysia
中国学校校友会,Persatuan Bekas Pelajar Sekolah Rendah Chung Kwo Kuala Lumpur,,"SJK(c) Chung Kwo, Jalan Loke Yow, 55200 Kuala Lumpur",Selangor,文教,214,Malaysia
义安校友会,"Persatuan Bekas Pelajar Ngee Ann, Kuala Lumpur",,"24, Jalan Budiman 11, Taman Mulia, 56000 Bandar Tun Razak, Kuala Lumpur.",Selangor,文教,214,Malaysia
中马培风校友会,Persatuan Bekas Murid Sek Pay Fong Malaysia Tengah,,"206, Jalan Mahkota, Taman Maluri, Cheras, 55100 Kuala Lumpur.",Selangor,文教,214,Malaysia
雪州雪邦学校校友会,"Persatuan Bekas Murid-Murid SRJK(C) Sepang, Selangor",,"134, Kg. Baru Sepang, Sepang, 43900 Selangor.",Selangor,文教,214,Malaysia
呀吃十八里中华小学校友会,Persatuan Murid-Murid Tua SRJK(C) Choon Hwa,,"Dewan SRK(C) Choon Hwa, Batu 18, Ulu Langat Selangor.",Selangor,文教,214,Malaysia
德教会紫生阁,Persatuan Ugama Pembangunan Akhlak Che Sang Khor,Che Sang Khor Moral Uplifting Society,"263, Persiaran Raja Muda Musa 41100 Klang, Selangor",Selangor,宗教,215,Malaysia
德教会紫生阁,Persatuan Ugama Pembangunan Akhlak Che Sang Khor,Che Sang Khor Moral Uplifting Society,"263, Persiaran Raja Muda Musa 41100 Klang, Selangor",Selangor,宗教,215,Malaysia
巴生滨海佛学会,Pertubuhan Penganut Buddha Klang Dan Pantai,The Klang & Coast Buddhist Association,"Lot 465, KM2, Persiaran Tengku Ampuan Rahimah, 41200 Klang, Selangor.",Selangor,宗教,215,Malaysia
吉隆坡崇真堂,Persatuan Pembinaan Rumah Berhala Thong Chin Thong Kuala Lumpur,Thong Chin Thong Temple,"Lot No, 9419, Jalan Jambu Berasa, 52000 Jinjang Selatan, Kuala Lumpur.",Selangor,宗教,215,Malaysia
福星庙理事会,,Management Committee Of Hock Sin Temple,"Lot 9418, Jinjang Selatan, 52000 Kuala Lumpur",Selangor,宗教,215,Malaysia
吉隆坡德教会紫嘉阁,Persatuan Memperbaiki Ahklak Che Kia Khor Kuala Lumpur,,"33-A, Jalan Hujan OUG, 58200 Kuala Lumpur",Selangor,宗教,215,Malaysia
吉隆坡德教会紫联阁,,Che Lian Khor Moral Uplifting Society,"87A, Jalan Hujan Emas 8, 58200 Kuala Lumpur",Selangor,宗教,215,Malaysia
吉隆坡圆智精舍,Persatuan Pengkajian Ajaran Buddha Yuan Zhi Kuala Lumpur,,"15-1, Jalan Budiman 25, Taman Mulia, 56000 Cheras, Kuala Lumpur",Selangor,宗教,215,Malaysia
吉隆坡黄老仙师慈忠庙,Rumah Berhala Wong Loo Sen See Chee Choong Temple Kuala Lumpur,,"29, Jalan Lombong, Batu 21/2, Off Jalan Cheras, 55200 Kuala Lumpur",Selangor,宗教,215,Malaysia
安邦学校会,Persatuan Murid Tua Sek On Pong,,"c/o SRJK(C) On Pong Lot 6, Main Street 68000 Ampang, Selangor",Selangor,文教,215,Malaysia
安邦哥沙与英达花园孟兰胜会,"Persatuan Penyokong Perayaan Yu Lan Sheng Hui Taman Kosas, Bukit Indah Ampang",,"33Jalan Kosas 1/3, Taman Kosas Ampang, 68000 Selangor",Selangor,宗教,215,Malaysia
加影仙四师爷宫,Persatuan Pengurusan Tokong Shen Sze She Yar,,"Lot 22 & 23, Jalan Mendaling, 43000 Kajang, Selangor.",Selangor,宗教,215,Malaysia
适耕庄德教会紫沛阁,"Persatuan Amal &Akhlak Che Pei Kok Sekinchan, Selangor",,"193, Jalan Gereja, 45400 Sekinchan, Selangor.",Selangor,宗教,216,Malaysia
加影镇方寺,Rumah Ibadat Ting Hong Sze,,"Lot 36, Jalan Tepi Sungai, Jalan Tukang (Belakang MayBank), Kajang, Selangor.",Selangor,宗教,216,Malaysia
仁加隆万寿宫,"Persatuan Pengurusan Tokong Ban Siew Keng, Jenjarom",,"Lot 5623, Jalan Sungai Buata, 42600 Sungai Jarom, Kuala Langat Selang",Selangor,宗教,216,Malaysia
双文丹地母娘庙理事会,Pertubuhan Pemuja Dewi Teh Moo Leong,,"c/o 45, Jalan Maccau, Serendah, 48200 Selangor.",Selangor,宗教,216,Malaysia
千百家佛教居士林,Persatuan Buddhist Chempaka,Chempaka Buddhist Lodge,"60, Jalan SS23/25, Taman SEA, 47400 Ptaling Jaya, Selangor.",Selangor,宗教,216,Malaysia
马来西亚道教总会,Persatuan Pertubuhan Agama Tao Malaysia,Federation Of Taoist Association Malaysia,"107- 2, Tingkat 2, Jalan 17/42, Taman Lawa, Off Jalan Kuching, 51200 Kuala Lumpur",Selangor,宗教,216,Malaysia
南洋同奉善堂雪兰莪分堂,Dewan Kebajikan Nanyang Thong Hong Siang T' ng Selangor & Wilayah Persekutuan,,"83A, Jalan 1/111B, Batu 3, Jalan Klang Lama, 58000 Kuala Lumpur.",Selangor,宗教,216,Malaysia
马来西亚(释、儒、道)道教会,,Malaysian Buddhist Confucius & Taoist Moral Society,"48, Jalan Kasipillay, Off Batu 3, Jalan Ipoh, 51200 Kuala Lumpur.",Selangor,宗教,216,Malaysia
马来西亚士拉央自在宫,,"Chee Choy Kong Temple Selayang, Malaysia","No.36A, Jalan 30, Selayang Baru 68100 Bt Caves, Selangor.",Selangor,宗教,216,Malaysia
莲花精舍,Persatuan Buddha Lotus,,"182A, Jalan Tun H S Lee, 50000 Kuala Lumpur.",Selangor,宗教,216,Malaysia
马来西亚德教联合总会,Persekutuan Persatuan-Persatuan AAeningkatan Akhlak Male,United Moral Uplifting Society Malaysia,"22A- 2, 2nd Floor, Persiaran Jubilee, Off Jalan Loke Yew 55200 Kuala Lumpur.",Selangor,宗教,216,Malaysia
魁镇庙理事会,Persatuan Penyokong Tokong Kui Tin Biow,,"Lot 5791/A, Taman Sri Reko, Jalan Reko. 43000 Kajang, Selangor.",Selangor,宗教,216,Malaysia
雪兰莪巴生德教会紫生阁,,Che Sang Khor Moral Uplifting Society,"263, Persiaran Raja Muda Musa, 41100 Klang Selangor.",Selangor,宗教,217,Malaysia
雪兰莪巴生天缘道堂,,Tiam Yam Toh Teng,"24, Jalan Cox, Klang, 41400 Selangor",Selangor,宗教,217,Malaysia
雪兰莪巴生德教会紫胜阁,,,"10B, Jalan Kawasari 5, Taman Eng Ann, 41150 Klang, Selangor.",Selangor,宗教,217,Malaysia
万津和一道坛,Persatuan Penganut Dewa Hoe Yit Banting,,"Lot LMS 827, Jalan Rumah Air JPG, 42700 Banting.",Selangor,宗教,217,Malaysia
雪兰莪德教会济仙阁,Persatuan Che Sen Khor Moral Uplifting Society,,"35, Jalan Othman 4/40,46050 Petaling Jaya, Selangor.",Selangor,宗教,217,Malaysia
增江佛教会,,Jinjang Buddhist Association,"30, Jalan West Fence, 52000 Jinjang Utara, Jinjang, Kuala Lumpu",Selangor,宗教,217,Malaysia
雪隆德教会紫芳阁,,The Kuala Lumpur & Selangor Che Huan Khor Moral Uplifting Society,"176, Jalan Halimahton, (Jalan Penghulu Mat), 5 KM Jalan Klang Lama, 58000 Kuala Lumpur.",Selangor,宗教,217,Malaysia
雪兰莪马来西亚佛学社,,Selangor Malaysia Buddhist Society,"197, Batu 3 3/4, Jalan Kelang Lama, 58000 Kuala Lumpur.",Selangor,宗教,217,Malaysia
药师佛精舍,,Medicine Buddha Yao Shi Fo Kuala Lumpur,"260F- 2, 2nd Floor, Jalan lpoh, Batu 2 1/2, 51200 Kuala Lumpur.",Selangor,宗教,217,Malaysia
医药佛精舍,Persatuan Buddha Yao Shi Fo Kuala Lumpur,,"260F-2, 2nd Floor, Jalan lpoh, Batu 2 1/2, 51200 Kuala Lumpur.",Selangor,宗教,217,Malaysia
雪邦区佛教会,Persatuan Buddhist Daerah Sepang,,"46, Kampung Baru, Sepang, 43900 Selangor.",Selangor,宗教,217,Malaysia
雪隆宏愿佛学会,Persatuan Penganut Buddha Hong Ying Selangor & Wilayah Persekutuan,,"4, Lorong Ayer Putih, Off Jalan Ayer Panas, 53200 Kuala Lumpur",Selangor,宗教,217,Malaysia
瓜劳雪兰莪晨光社,"Kelab Sen Kong Shor, Kuala Selangor",,"26, Batu Burok, Kuala Selangor, 45000 Selangor.",Selangor,体育联谊,218,Malaysia
巴生工商俱乐部,,The Klang Commercial Athletic Club,"46, Jalan Tapah, Off Jalan Goh Hock Huat, Klang, 41400 Selangor",Selangor,体育联谊,218,Malaysia
巴生涪声协进社,,Ngoh Shing Recreation Club,"16- 18, Jalan Bukit Kuda, Klang, 41300 Selangor.",Selangor,体育联谊,218,Malaysia
瓜拉冷岳篮球协会,Persatuan Bola Keranjang Kuala Langat Selangor,,"Lot 3486, Jalan Morid, 42700 Banting, Selangor.",Selangor,体育联谊,218,Malaysia
公余俱乐部（新古毛）,,Kong Ee Club,"9, Maxwell Street K Kubu Baru, 44000 Selangor",Selangor,体育联谊,218,Malaysia
壶兰俱乐部,Kelab Por Lan,,"13 & 15, Jalan Thambapillal Brickfields, 50470 Kuala Lumpur.",Selangor,体育联谊,218,Malaysia
吉隆坡商卢俱乐部,Kelab Siong Loo Ampang Kuala Lumpur,,"1-7, Tingkat 6, Jalan Ampang, 50450 Kuala Lumpur.",Selangor,体育联谊,218,Malaysia
八丁燕带益群俱乐部,Kelanb Aik Kuan Btg Berjuntai,,"18, Jalan Besar, Btg Berjuntai, 45600 Selangor.",Selangor,体育联谊,218,Malaysia
吉隆坡和平俱乐部,,The Peace Club Kuala Lumpur,"65 & 67, 3rd Floor, Wisma Hopo, Changkat Thambi Dollah, 55100 Kuala Lumpur.",Selangor,体育联谊,218,Malaysia
马来西亚创价学会,Persatuan Soka Gakkai Malaysia,Malaysia Soka Gakkai Association,"243, Jalan Bukit Bintang, 55100 Kuala Lumpur.",Selangor,宗教,218,Malaysia
大地武术醒狮健身学院,,Tai Tee Kebudayaan Jasmani,"26, Jalan Mutiara Satu, Taman Mutiara, Cheras, 56000 Kuala Lumpur",Selangor,体育联谊,218,Malaysia
群乐俱乐部,Persatuan Kuan Loke,,"90, Jalan SS 9A/18A, Petaling Jaya, 47300 Selangor.",Selangor,体育联谊,219,Malaysia
联邦直辖区太极气功十八式总会,Pertubuhan Senamtera Taiji Qigong Bercorak 18 Wilayah Persekutu,,"3-48, Tingkat 3, Kompleks Desa, Kepong, 52100 Kuala Lumpur.",Selangor,体育联谊,219,Malaysia
群乐俱乐部（叻思）,,"Kuan Lok Club, Rasa Selangor","19, Jalan Kuala Kali, Rasa, 44200 Selangor.",Selangor,体育联谊,219,Malaysia
马来西亚中华外内丹功学会,,Waitankung & Neitankung Society Malaysia,"44-46A, Jalan TK 1/1 Taman Kinrara, Batu 7, Jalan Puchong, 58200 Kuala Lumpur.",Selangor,体育联谊,219,Malaysia
马来西亚五祖武术体育会,,Malaysia Ngoh Chor Plyseed & Sport Association,"241/2, Jinjang Utara, 52000 Kuala Lumpur.",Selangor,体育联谊,219,Malaysia
马来西亚神龙太极拳学会,Persatuan Tai Chi Chuan Shenlong Malaysia,,"29-1, Jalan 2/128, Town Centre, Taman Gembira,58200 Kuala Lumpur.",Selangor,体育联谊,219,Malaysia
吉隆坡最乐剧团,Persatuan Derama Amator Chui Lok,,"106, Jalan Abd Samad, Off Jalan Brickfields, 50470 Kuala Lumpur",Selangor,体育联谊,219,Malaysia
马来西亚象棋总会,Persatuan Xiang Qi Malaysia,,"11, Jalan Sultan, 50000 Kuala Lumpur.",Selangor,体育联谊,219,Malaysia
隆雪益贤俱乐部,Kelab Yik Yin Kuala Lumpur & Selangor,,"89, 4th Floor, Jalan Sultan, 50000 Kuala Lumpur.",Selangor,体育联谊,219,Malaysia
隆雪联胜国术团,Persatuan Kebudayaan Jasmana Luen Seng Kuala Lumpur & Selangor,,"25, Jalan Sarawak, Di Pudu, 55200 Kuala Lumpur.",Selangor,体育联谊,219,Malaysia
马来西亚郭林气功研究会,Persatuan Guolin Qigong Malaysia,,"5-4, Tingkat Tiga Jalan SP 2 /1, Taman Serdang Perdana Seksyen 2, 43300 Seri Kembangan, Selangor.",Selangor,体育联谊,219,Malaysia
加影善余俱乐部,Kelab Sen Yee,,"No.23, Tingkat 1, Jalan Mendalin 43000 Kajang",Selangor,体育联谊,219,Malaysia
雪兰莪加埔俱乐部,Kelab Kapar Selangor,,"152, Jalan Besar, Kapar, Klang, 42200 Selangor",Selangor,体育联谊,220,Malaysia
万津五祖武术体育分会,Persatuan Pendidikan Jasmani Ngor Chor Malaysia Cawangan Banting,,"Lot 334, Kg Pulau, 42700 Banting.",Selangor,体育联谊,220,Malaysia
万津业余俱乐部,,"Yiap Eu Club, Banting","C /0 199,1st Floor, Jalan Bunga Pekan, Kaw 6, Banting, Kuala Langat 42700 Selangor.",Selangor,体育联谊,220,Malaysia
雪兰莪瓜拉冷岳业余篮球协会,Persatuan Bola Keranjang Amatur Kuala Langat,,"15-A, Jalan Bunga Pekan 4, Kawasan 6, Banting, 42700 Selangor.",Selangor,体育联谊,220,Malaysia
雪兰莪三山别墅,Kelab San Sang Selangor,,"294A, Jalan Raja Laut, 50350 Kuala Lumpur.",Selangor,体育联谊,220,Malaysia
雪兰莪侨安俱乐部,,Selangor KhiewOnn Club,"18A, Padang Awan (Dewan Org Ramai) Jalan Kubus Kuala Ampang, 68000 Ampang, Selangor.",Selangor,体育联谊,220,Malaysia
雪兰莪暨联邦直辖区客属中原联谊社,Persatuan Choong Yuen Lian Ngi Hakka W P & Selangor,,"63-E5, Tingkat 1, Jalan Sultan, 50000 Kuala Lumpur.",Selangor,体育联谊,220,Malaysia
雪兰莪庆同乐慈善国术团,,Selangor Rombongan Kesenian Kheng Thung Lok,"149, Jalan Petaling, 50000 Kuala Lumpur.",Selangor,体育联谊,220,Malaysia
雪兰莪人镜慈善白话剧社,,Selangor Yan Keng Benevolent Dramatic Association,"51, Jalan Sultan, 50000 Kuala Lumpur.",Selangor,体育联谊,220,Malaysia
雪兰莪潮州联谊社,,The Sei Teo Chew Recreation Club,"195K, Blok B, Bangunan Choo Cheng Khay, 50460 Kuala Lumpur.",Selangor,体育联谊,220,Malaysia
中文电脑学会(雪隆),,Chinese Language Computing Society (Selangor & FT),"Lot 18- 19, Wisma Zelan, 1 Jalan Tasik Permaisuri 2, Bandar Tun Razak, 56000 Kuala Lumpur.",Selangor,体育联谊,220,Malaysia
雪兰莪安邦健身社,,Ampang Physical Culture Association Selangor,"66, Tingkat 2, Jalan Besar, Ampang, 68000 Selangor.",Selangor,体育联谊,220,Malaysia
雪州大港华商俱乐部,Kelab Rekreasi Saudagar Cina Sg. Besar Selangor,,"8A, Tingkat 1 & 2t Jalan Menteri, Sg. Besar, 45300 Selangor.",Selangor,体育联谊,221,Malaysia
雪兰莪桃源俱乐部,,Selangor Toh Guan Club Klang,"10, 2nd Floor, Jalan Tuanku Diauddin, 41000 Klang, Selangor.",Selangor,体育联谊,221,Malaysia
雪隆少林气功内劲一指弹总会,Pertubuhan Senaman Shau-Ling Chi-Kong Nei Jalan Yit Jie Chan Selangor & Kuala Lumpur,,"33-1, Jalan 11/34A, Kepong Entrepreners Park, Jalan Kepong 52100, Kuala Lumpur.",Selangor,体育联谊,221,Malaysia
雪隆嵩山少林武术会,Persatuan Seni Mempertahankan Diri Sungsan Shaikin Wilayah Persekutuan & Selangor,,"361D, Jalan Batu Bata, Off Jalan Tun Razak, 50400 Kuala Lumpur.",Selangor,体育联谊,221,Malaysia
雪隆太极拳总会,Pergabungan Tai Chi Wilayah Persekutuan Kuala Lumpur & Selangor,,"702,7th Floor, Bg Lee Wah Bank, Medan Pasar, 50050 Kuala Lumpur.",Selangor,体育联谊,221,Malaysia
雪隆太极气功十八式健身社,Persatuan Taiji Qigong Bercorak 18 Selangor & Wilayah Persekutuan,,"21, Jalan Petaling, 50000 Kuala Lumpur.",Selangor,体育联谊,221,Malaysia
雪隆精武体育会,Persatuan Sukan Chinwoo Selangor & Kuala Lumpur,,"Stadium Chinwoo, Jalan Hang Jebat 50150 Kuala Lumpur.",Selangor,体育联谊,221,Malaysia
雪隆狮团联合总会,Pergabungan Persatuan Tarian Singa Selangor & Wilayah Persekutuan,,"118B, Jalan Choo Cheng Khay,  Off Jalan Maharajalela, 50460 Kuala Lumpur.",Selangor,体育联谊,221,Malaysia
雪隆武术总会,Persekutuan Wushu Selangor & Wilayah Persekutuan Kuala Lumpur,,"Suite No 2, 2nd Floor, Wisma OCM, Jalan Hang Jebat 50150 Kuala Lumpur.",Selangor,体育联谊,221,Malaysia
雪兰莪鞋商俱乐部,Kelab Majikan Pembuat Kasut Selangor,,"21 - A, Lorong Meranti 1, Off Jalan Kenanga, 55200 Kuala Lumpur.",Selangor,体育联谊,221,Malaysia
雪兰莪陶然俱乐部,Kelab Thau Yan Selangor,,"30B, Jalan Lengkongan Brunei, Pudu, 55100 Kuala Lumpur.",Selangor,体育联谊,221,Malaysia
雪隆中华外丹功研究学会,Pertubuhan Pengkajian Waitankung Selangor & Kuala Lumpur,,"11C, Jalan Gandek, Off Jalan San Peng, 55200 Kuala Lumpur.",Selangor,体育联谊,221,Malaysia
瓜拉冷岳爱心功德会,Persatuan Penyayang Kuala Langat Selangor,,"NO.127A, Jalan Bunga Pekan 2, Kawasan 6, 42700 Banting, Selangor.",Selangor,慈善福利,222,Malaysia
马来西亚华人残障协会,Persatuan Orang Cacat Cina Malaysia,Society Of The Chinese Disabled Person Malaysia,"3, Jalan Pipit 2, Bandar Puchong Jaya, 47100 Puchong, Selangor.",Selangor,慈善福利,222,Malaysia
八打灵工商业余俱乐部,Kelab Kong Seong Yip Yee Petaling Jaya,,"7, Jalan 8/1 D, Tingkat 2, Petaling Jaya, 46050 Selangor.",Selangor,体育联谊,222,Malaysia
甲洞华人义山机构,,"Chinese Cemetery Association of Kepong, Jinjang & Batu Village.","Lot 182, Jalan Jambu Arang Dua, 52000 Jinjang Selatan, Kuala Lumpur.",Selangor,慈善福利,222,Malaysia
德胜之家,Rumah Victory,House of Victory,"9- 3, Jalan 8/146, Bandar Tasik Selatan, 57000 Sungai Besi, Kuala Lumpur.",Selangor,慈善福利,222,Malaysia
吉隆坡广东义山,,The Assn Of Kwong Tong Cemetery Management Kuala Lumpur.,"Lot 507, Seksyen 69, Jalan Dewan Bahasa, 50460 Kuala Lumpur.",Selangor,慈善福利,222,Malaysia
雪隆华人义山联合会,Gabungan Persatuan Kubur Cina Wilayah Persekutuan Dan Selangor,,"Lot 5Q7, Seksyen 69,Jalan Dewan Bahasa, 50460 Kuala Lumpur.",Selangor,慈善福利,222,Malaysia
加影民生体育会,Persatuan Sukan Min Sen Min Sen Sports Association,,"12 B, Taman Hijaujalan Sg. Chua, 43000 Kajang Selangor.",Selangor,体育联谊,222,Malaysia
蕉赖福建义山,Perkuburan Orang-Orang Cina Hokkien Di Batu 9 & 11 Cheras,,"Batu 11, Cheras Ulu Langat Selangor.",Selangor,慈善福利,222,Malaysia
加影广义公会,,The Kajang Kwang Tung Public Cemetery Assn,"16, 2nd & 3rd Floor, Jalan Tun Abdul Aziz, Kajang, 43000 Selangor.",Selangor,慈善福利,222,Malaysia
巴生滨海华人积堂老人院,Rumah Orang Tua Chik Thong Klang Dan Pantai,,,Selangor,慈善福利,222,Malaysia
武吉丁雅华人公冢,,The Bukit Tangga Chinese Cemetery,"Lot 2442, Jalan Besar, Kg.Tiram Burok, Tg. Karang, 45500 Selangor.",Selangor,慈善福利,223,Malaysia
马来西亚圣约翰救伤机构雪兰莪滨海区,,St. John Ambulans Malaysia Kawasan Pantai Selangor,"Bangunan Yeo Cheng Swee, 2984A, Persiaran Raja Muda Musaz 41100 Klang, Selangor.",Selangor,慈善福利,223,Malaysia
万挠广福义山董事会,"Jawatankuasa Perkuboran Kwong Hock Rawang, Selangor",,"71, Jalan Silang, 48000, Rawang, Selangor.",Selangor,慈善福利,223,Malaysia
八打灵再也华人义山公会,,Petaling Jaya Chinese Cemetery Assn Gui Yuan Creamatorium,"Jalan 51A/229, Petaling Jaya, 46100 Selangor.",Selangor,慈善福利,223,Malaysia
八打灵白沙罗新村华人义山委员会,Persatuan Perkuburan Cina Kampung Damansara Petaling Jaya,,"C/O Ruan Liang Temple 122, Jalan 17A/1, Kampung Baru Damansara, 46400 Petaling Jaya, Selangor.",Selangor,慈善福利,223,Malaysia
士拉央华人义理事会,Persatuan Pengelolaan Perkuburan Cina Selayang,,"2-4, Jalan 1A, Selayang Baru, Batu Caves, 68100 Selangor.",Selangor,慈善福利,223,Malaysia
万挠福善公会,Persatuan Hock Sian Rawang,,"74-B, Jalan Silang, Rawang, 48000 Selangor.",Selangor,慈善福利,223,Malaysia
同善医院,,Tung Shin Hospital,"102, Jalan Pudu, 55100 Kuala Lumpur.",Selangor,慈善福利,223,Malaysia
新街场广福义山联谊会,Persatuan Kebajiakn Perkuburan,,"C/0 Yu Cheong Baru, 24, Jalan Pejabat Pos, Sungai Besi, 57000 Kuala Lumpur.",Selangor,慈善福利,223,Malaysia
雪邦华人义山委员会,J/K Pengurusan Tanah Perkuburan Orang Cina Sepang,,"167, Kampung Baru, Sungai Pelek, 43950 Selangor",Selangor,慈善福利,223,Malaysia
吉隆坡文华国际青年商会,,Junior Chamber Kuala Lumpur Mandarin,"20-1 B, Jalan Bandar 8, Pusat Bandar Puchong.",Selangor,青年妇女,224,Malaysia
双溪威青年俱乐部,,Sungai Way Youth Club,"19A, Jalan SS 9A/4A, Seri Setia, 47300 Petaling Jaya, Selangor.",Selangor,青年妇女,224,Malaysia
马来西亚宗乡青联合总会,Persatuan Belia Xiang Lian Malaysia,The Federation of Malaysian Clans and Guilds Youth Associations,"55- 59, 3rd Floor, Wisma Eng Choon, Jalan Ampang, 50450 Kuala Lumpur.",Selangor,青年妇女,224,Malaysia
雪兰莪华人女子精武体育会,,Selangor Chinese Women Chinwoo Athletic Association,"15- 17, Jalan Tong Shin, 50200 Kuala Lumpur.",Selangor,青年妇女,224,Malaysia
雪兰莪华人妇女协志会,Persatuan Li CHee Wanita Cina Selangor,,"31, Jalan Bedara, 50200 Kuala Lumpur.",Selangor,青年妇女,224,Malaysia
雪隆华人妇女励志会,Persatuan Li Chee Wanita Cina SKL,SKL Chinese Women Li Chee Association,"31, Jalan Bedara, 50200 Kuala Lumpur.",Selangor,青年妇女,224,Malaysia
雪兰莪华人妇女协志会,Persatuan Li CHee Wanita Cina Selangor,,"31, Jalan Bedara, 50200 Kuala Lumpur.",Selangor,青年妇女,224,Malaysia
马来西亚青年运动总会,,Young Malaysians Movement,"12B, Jalan Kancil, Off Jalan Pudu, 55100 Kuala Lumpur.",Selangor,青年妇女,224,Malaysia
马来西亚青年团结运动,Pertubuhan Gerakan Bella Bersatu Malaysia,,"2nd Floor, No.8, Jalan Cempaka 14, Taman Cempaka, 68000 Ampang Selangor.",Selangor,青年妇女,224,Malaysia
波德申福建会馆,Persatuan Hokkien Port Dickson Negeri Sembilan,,"19,Pasar Baru,Port Dickson, 71000 Port Dickson, Negeri Sembilan.",森美兰,地缘,225,Malaysia
波德申海南会馆,Persatuan Hainan Port Dickson,,"66C, Tingkat Atas, Jalan Baru, 71000 Port Dickson, Negeri Sembilan.",森美兰,地缘,225,Malaysia
森美兰中华大会堂,Dewan Perhimpunan China Negeri Sembilan,Negeri Sembilan Chinese Assembly Hall,"96 (2nd FloorlJalan Temiang, 70200 Seremban, Negeri Sembilan.",森美兰,综合,225,Malaysia
森美兰华人公会,Persatuan Tiong Hua Negeri Sembilan,Negeri Sembilan Chinese Association,"96(atas) Jalan Tem iang, 70200 Seremban, Negeri Sembilan.",森美兰,综合,225,Malaysia
森美兰晏斗华人公会,Persatuan Cina Rantau Negeri Sembilan ,Rantau Chinese Association Negeri Sembilan,"Lot 3713 /172-173, Tingkat 1, Taman Pasir Mas, 71200 Rantau, Negeri Sembilan.",森美兰,综合,225,Malaysia
庇月劳客属公会,Persatuan Hakka Kuala Pilah,,"102Jalan Yam Tuan,72000 Kuala Pilah, Negeri Sembilan",森美兰,地缘,225,Malaysia
淡边福建会馆,,The Tampin Hokkien Association,"80A,(1st Flr), Kg. Baru, 73000 Tampin, Negeri Sembilan.",森美兰,地缘,225,Malaysia
马口华团联合会,Gabungan Persatuan Tiong Hua Bahau Negeri Sembilan,,"47, Tingkat 2, Jalan D ato5 Jem pol Jalan Besar, 72100 Bahau, Negeri Sembilan.",森美兰,综合,225,Malaysia
淡边浮罗士邦华人公会,Persatuan Cina Tampin Dan Pulau Sebang Neger Sembilan,,"80A,(1st Flr), Kg. Baru, 73000 Tampin, Negeri Sembilan.",森美兰,综合,225,Malaysia
庇月劳海南会馆,Persatuan Hainan Kuala Pilah,,"108, Jalan Yam Tuan 72000 Kuala Pilah, Negeri Sembilan.",森美兰,地缘,225,Malaysia
金马士客属公会 ,Persatuan Hakka Gemas Negeri Sembilan ,,"Lot 961, Jalan Pasar, 73400 Gemas, Negeri Sembilan.",森美兰,地缘,226,Malaysia
东安会馆,Persatuan Toong Onn Kwoon ,,"72, Jalan Murray, Seremban, Negeri Sembilan.",森美兰,地缘,226,Malaysia
瓜拉庇月劳应和会馆   ,Persatuan Yin Foh,Yin Foh Association Kuala Pilah,"166, (Tingkat 2), Jalan Seremban Lama, 72000 Kuala Pilah, Negeri Sembilan.",森美兰,地缘,226,Malaysia
淡边桂高波联谊会,Persatuan Kwai Kooh Song Tampin,Tampin Kwai Kooh Song Association ," 202, Kampung Baru Tampin, 73000 Tampin, Negeri Sembilan.",森美兰,地缘,226,Malaysia
淡边海南会馆 ,Persatuan Hainan Tampin,," 282, Pulau Sebang, 73000 Tampin, Melaka.",森美兰,地缘,226,Malaysia
淡边客家公会  ,Pertubuhan Hakka Tampin,Hakka Association Tampin,"P.S. 1044, Jalan Perhentian Bas, 73000 Pulau Sebang,Tampin.Pos., Negeri Sembilan.",森美兰,地缘,226,Malaysia
淡边嘉应同乡会,Kah Yin Thong Heong Fui Tampin ,,"AG 3962(Tingkat 1) Jalan Pasar Pulau Sebang, 73000 Tampin, Negeri Sembilan.",森美兰,地缘,226,Malaysia
瓜拉庇月劳福莆仙公会 ,Persatuan Hock Pou Sen Kuala Pilah Negeri Sembilan,,"200, Jalan Tung Yen, 72000 Kuala Pilah, Negeri Sembilan.",森美兰,地缘,226,Malaysia
瓜拉庇月劳广东会馆,Persatuan Kwang Tung Kuala Pilah,Kuala Pilah District Kwang Tung Association,"68, Jalan Dato, Undang Johol 72000 Kuala Pilah, Negeri Sembilan.",森美兰,地缘,226,Malaysia
瓜拉庇月劳永春公所   ,Persatuan Eng Choon Kong So Kuala Pilah,Kuala Pilah Eng Choon Kong So,"164, Jalan Yam Tuan Taden,72000 Kuala Pilah, Negeri Sembilan.",森美兰,地缘,226,Malaysia
马口潮州会馆 ,Persatuan Teo Chew Bahau ,,"15, (Tingkat 2), Jalan Dato5 Besar, 72100 Bahau, Negeri Sembilan.",森美兰,地缘,226,Malaysia
金马士福建会馆 ,Persatuan Hokkien Gemas Negeri Sembilan  ,Negeri Sembilan Gemas Hokkien Association,"967, Jalan Pasar, 73400 Gemas, Negeri Sembilan.",森美兰,地缘,226,Malaysia
马口泷江同乡会   ,Persatuan Siong Kong Bahau,Siong Kong Association,"108, Jalan Gurney 72100 Bahau, Negeri Sembilan.",森美兰,地缘,227,Malaysia
日拉务福建会馆,Persatuan Hokkien Jelebu Negeri Sembilan,,"26, Jalan Besar, 71600 Kuala Klawang, Jelebu, Negeri Sembilan.",森美兰,地缘,227,Malaysia
马来西亚海陆会馆   ,Persatuan Hoi Loke Malaysia,Hoi Loke Association Malaysia,"80-C ,Tingkat 2, Jalan Rasah, 70300 Seremban, Negeri Sembilan.",森美兰,地缘,227,Malaysia
马口广西会馆  ,Persatuan Kwang Si Bahau Negeri Sembilan,,"47Jalan Dato5 Leia Petra, 72100 Bahau, Negeri Sembilan.",森美兰,地缘,227,Malaysia
柔和海南会馆,Persatuan Hainan Johol Negeri Sembilan,,"27,  Main Road, Johol Kuala Pilah, Negeri Sembilan.",森美兰,地缘,227,Malaysia
柔河永春公所,"Persatuan Keturunan Eng Choon Kong Soh, Johol Negeri Sembilan",,"45, Jalan Besar, 73100 Johol, Negeri Sembilan.",森美兰,地缘,227,Malaysia
森甲河婆同乡会,Persatuan Hopo Negeri Sembilan/Melaka,,"598-B Jalan Besar, 73000 Tampin, Negeri Sembilan.",森美兰,地缘,227,Malaysia
马口高州会馆 ,Persatuan Ko Chow Bahau ,Bahau Ko Chow Asssociation ,"106,Gurney Road, Bahau, Jempol Negeri Sembilan.",森美兰,地缘,227,Malaysia
日拉务嘉属会馆,Persatuan Kah Shook Fui Kon,,"98, Keyser Road, 71600 Kuala Klawang, Jelebu, Negeri Sembilan.",森美兰,地缘,227,Malaysia
马口客家公会   ,Persatuan Hakka Bahau,Bahau Hakka Association,"105, Jalan Gurney 72100, Bahau, Negeri Sembilan.",森美兰,地缘,227,Malaysia
仁保县海南会馆,Persatuan Hainan Daerah Jempol,,"105, Jalan Dato, Komo,72100 Bahau,Negeri Sembilan.",森美兰,地缘,227,Malaysia
马口福建会馆,Persatuan Hokkian Bahau,Bahau Hokkien Association,"107 (atas) Jalan Mewah, 72100 Bahau, Negeri Sembilan.",森美兰,地缘,227,Malaysia
森美兰惠州会馆,Persatuan Fui Chiu Negeri Sembilan,Negeri Sembilan Fui Chiu Association,"Tingkat 2, Wisma Fui Chiu, 15, Jalan Nunis, 70000 Seremban, Negeri Sembilan.",森美兰,地缘,228,Malaysia
