Name_CH,Name_ML,Name_EN,Location,Region,Category,PageNumber,Country
修德善堂平安村分堂,Persatuan Pendidikan Moral Seu Teck Sean Tong Tasek Gelugor Seberang Perai Utara,,"No.2785, Tingkat Selamtat 2, Kampong Selamat, Pulau Pinang.",Penang,宗教,121,Malaysia
直落巴巷峰溪山大伯公,Persatuan Rumah Berhala Tua Pek Kong Teluk Bahang,,"Lot 552, Teluk Bahang, 11050 Pulau Pinang.",Penang,宗教,122,Malaysia
真佛宗槟城护弘堂,Persatuan Penganut Agama Buddha Chen Foh Chong (Foo Hong Tong) Pulau Pinang,,"1228L-3, MK 13, Jalan Paya Terubong, Pulau Pinang.",Penang,宗教,122,Malaysia
自来宫济公仙师,Persatuan Penganut Dewa Ji Gong Sian Shi,,"Bk 16-9-5, Grand View Height Paya Terubong, Air ltam, 11060 Pulau Pinang.",Penang,宗教,122,Malaysia
玉山祠,Rumah Berhala Geok San Soo,,"681-K, Tanjung Bungah, 11200 Pulau Pinang.",Penang,宗教,122,Malaysia
真佛宗槟城真圣同修会,Pertubuhan Penganut Agama Buddha Zhien Fo Zhong Zhen Sheng Tong Xiu Hui,,"75L Jalan Terengganu, Pulau Pinang.",Penang,宗教,122,Malaysia
镇应宫金府大人,Persatuan Penganut Dewa Chern Ying Keong Kim Hu Tai Jin,,"22G, Jalan Perak Pinang.",Penang,宗教,122,Malaysia
紫竹林法坛,Persatuan Penganut Buddha Chee Chu Un Fa Than Pulau Pinang,,"349-T Ladang Perangin, 10300 Pulau Pinang.",Penang,宗教,122,Malaysia
震山阁老佛,Pertubuhan Penganut Dewa Chin San Kok-Lau Hut Bukit Mertajam Seberang Perai,,"TS 3958, MK 17, Kg. Aston, Bukit Mertajam, Seberang Perai.",Penang,宗教,122,Malaysia
爪夷村德教会振济阁,Persatuan Pendidikan Akhlah Chin Chi Kor,,"1930, Jalan Sekolah, kg. Jawi,14200 Sg Bakap, Seberang Perai Selatan, Penang.",Penang,宗教,122,Malaysia
爪夷福德祠理事会,Rumah Berhala Hock Teik See,,"Jalan Badak Mati, Sungai Bakap, 14200 Sungai Jawi, Pulau Pinang.",Penang,宗教,122,Malaysia
爪夷济公坛,Rumah Berhala Chee Kong Sg. Bakap Seberang Perai Selatan,,"1513, MK 4 Jalan Badak Mati, Sg. Bakap, Seberang Perai Selatan.",Penang,宗教,122,Malaysia
槟城浮罗公益阅书报社,Kong Yit Yat Soo Poh Seah,,"124, Main Road Balik Pulau, 11000 Pulau Pinang.",Penang,体育联谊,123,Malaysia
槟城慧音社,Pertubuhan Hui Yin Seh Pulau Pinang,,"700 H, Jalan Linking,11500 Ayer Itam, Pulau Pinang.",Penang,体育联谊,123,Malaysia
槟城阿德雷德之友协会,Persatuan Sahabat Adelaide Pulau Pinang,The Friends Of Adelaide Association Penang Penang Development Corporation,"No.1, Jalan Sg. Nibong, Bayan Lepas, Pulau Pinang.",Penang,体育联谊,123,Malaysia
槟城报界俱乐部,"Kelab Wartawan, Pulau Pinang",Penang Press Club,"No.2L Lorong Birch, 10250 Penang.",Penang,体育联谊,123,Malaysia
槟城华夏智能气功协会,Persatuan Hwaxia Zhineng Qigong Pulau Pinang,,"283-A, Lorong Tampin, 10150 Pulau Pinang.",Penang,体育联谊,123,Malaysia
槟城柑仔园牛皮塘区居民协会,Persatuan Penduduk Kawasan Kulit Lembu,Kulit Lembu Residents Association,"389-A, Jalan Dato Keramat 10150 Pulau Pinang.",Penang,体育联谊,123,Malaysia
槟城柴堤前及头条路区居民协会,Persatuan Penduduk Kawasan Jalan Maxwell Dan Jalan Magazine,,"65, Prangin Market, 10100 Pulau Pinang.",Penang,体育联谊,123,Malaysia
槟城红灯角填地居民协会,"Persatuan Penduduk-Penduduk Tepi Pantai, Pengkalan Weld",,"138, Reclamation Area, Pengkalan Weld, 10300 Pulau Pinang.",Penang,体育联谊,123,Malaysia
北海同侨社,Persatuan Tong Keow Butterworth Butterworth Tong Keow Seah,,"5043, R/Persatuan P/Puri Ria, Lebuh Kampung Benggali, 12200 Butterworth.",Penang,体育联谊,123,Malaysia
北海林发足球俱乐部,Kelab Bolasepak Lim Huat Butterworth,,"3, Tingkat Teratai, Raja Uda, Butterworth, Pulau Pinang.",Penang,体育联谊,123,Malaysia
北海峇东丁雅龙昆体育会,Persatuan Jasmani Loong Kuan Butterworth Province Wellesley,,"8877, Permatang Tengah, 13000 Butterworth.",Penang,体育联谊,123,Malaysia
槟城乔治市精武体育会,Persatuan Seni Mempertahankan Diri Chin Woo Georgetown,,"9-12-9, Tingkat Paya Terubong 2, Taman Terubong Jaya, 11600 Pulau Pinang.",Penang,体育联谊,124,Malaysia
槟城南北少林健身社,,North South Gymnasium Penang,"774-A, Hill Railway Road, Air ltam, 11500 Pulau Pinang.",Penang,体育联谊,124,Malaysia
槟城七星螳螂国术会,Persatuan Seni Mempertahankan Diri Tang Lang,,"464-E, Jalan Hill Railway Mk-16, 11500 Air ltam, Pulau Pinang.",Penang,体育联谊,124,Malaysia
槟城精形体育会,Pg. Ching Ying Sports Gymnasium,,"3-Q, Jalan Semarak Api Bandar Baru, 11500 Air Itam, Pulau Pinang.",Penang,体育联谊,124,Malaysia
槟城跑马园居民协会,Persatuan Pendudukan Taman Lumba Kuda Pulau Pinang,,"35, Jalan Goh Guan Ho, 11400 Penang.",Penang,体育联谊,124,Malaysia
槟城龙昆体育会,,Penang Loong Kuan Physical Culture Association,"l-D, Jalan Fettes, 11200 Pulau Pinang.",Penang,体育联谊,124,Malaysia
槟城南方大厦居民协会,"Persatuan Penghuni-Penghuni Wisma Lam Hong, Pulau Pinang",,"159-2-11, Jalan Sungai Pinang. 10150 Pulau Pinang.",Penang,体育联谊,124,Malaysia
槟城精武体育会,Persatuan Senaman Chin Woo Pulau Pinang,Penang Chinese Chin Woo Athletic Association,"180-A, Jalan Burmah, 10050 Pulau Pinang.",Penang,体育联谊,124,Malaysia
槟城空手道同盟国际心馆,,Penang Kerate Brotherhood,"50, Jalan Kuantan, 10150 Pulau Pinang.",Penang,体育联谊,124,Malaysia
槟城前进体育会,,Penang Forward Sports Club,"No.29, 1st Floor Jalan Zainal Abidin, 10400 Penang.",Penang,体育联谊,124,Malaysia
槟城慕韩别墅,,Mor Hun Club Penang,"122, Armenian Street Penang.",Penang,体育联谊,124,Malaysia
槟城篮球总会威南分会,Persatuan Bola Keranjang Seberang Perai Salatan,,"1922, Jalan Sekolah, Kg.Jawi, Sg.Bakap, 14200 Seberang Perai Salatan.",Penang,体育联谊,124,Malaysia
槟城协德社公司,Penang Heap Teik Seah Kongsi,,"No.717, Sg. Dua MK 13 Gelugor, Pulau Pinang.",Penang,体育联谊,125,Malaysia
槟城太极体育会,Persatuan Taiji Pulau Pinang,,"63, Jalan York, 10450, Pulau Pinang.",Penang,体育联谊,125,Malaysia
槟城温馨联谊会,Pertubuhan Wen Xin Pulau Pinang,Penang Wen Xin Association,"206, Jalan Burma, 10350 Pulau Pinang.",Penang,体育联谊,125,Malaysia
槟城友联别墅,,Penang Union Club,"125-F 2nd Floor Wisma Getah, Jalan Macalister, 10450 Pulau Pinang.",Penang,体育联谊,125,Malaysia
槟城业余音乐社,Persatuan Muzik Yip Yue,Yip Yue Musical Association,"75A, Jalan Telepon, 10400 Pulau Pinang.",Penang,体育联谊,125,Malaysia
槟城少室山健身社,,Penang Seow Seet San Health Culture Association,"13, Jalan Keh Chuan, 10400 Pulau Pinang.",Penang,体育联谊,125,Malaysia
槟城土桥尾组屋居民协会,Persatuan Penduduk-Penduduk Noordin Street Residents Association Noordin St. Ghaut Flats Penang,,"107, Noordin St. Ghaut Flats, 10300 Pulau Pinang.",Penang,体育联谊,125,Malaysia
槟城生活公市组屋居民协会,Persatuan Penduduk Penduduk Rumah Pangsa Peoples' Court Penang,,"C-5, Peoples' Court Off Campbell St., 10100 Pulau Pinang.",Penang,体育联谊,125,Malaysia
槟城升旗山84体育会,Kelab Sukan Bukit Bendera 84 Pulau Pinang.,,"No.10, Jalan Sungai Ujong, 10100 Pulau Pinang.",Penang,体育联谊,125,Malaysia
槟城音乐协会,Persatuan Philharmonic Pulau Pinang,Penang Philharmonic Society,"No.43, Lebuh Kimberlay, 10100 Pulau Pinang.",Penang,体育联谊,125,Malaysia
槟城少慈山体育会,Persatuan Kebudayaan Jasmani Seow Chu Sang,,"43, Prangin Lane, 10300 Pulau Pinang.",Penang,体育联谊,125,Malaysia
槟城少林国术健身社,,Pg. Sao Lim Athletic Association,"42, Lebun Muntri, 10200 Pulau Pinang.",Penang,体育联谊,125,Malaysia
槟城朱家拳体育会,Pertubuhan Keolahragaan Chu-Ka Pulau Pinang,,"23-B, Medan Angsana Satu, Bandar Baru Air ltam, 11500 Penang",Penang,体育联谊,126,Malaysia
槟岛南区乡镇联谊会,"Persatuan Perpaduan Penduduk-Penduduk Daerah Bakat Daya, Pulau Pinang",,"56, Jalan Mayang Pasir， Bayan Baru, 11950 Penang.",Penang,体育联谊,126,Malaysia
打枪埔区醒狮硏究社,Institusi Pengkajian Tarieth Singa,,"H-12, Jalan Padang Tembak, 11400 Pulau Pinang.",Penang,体育联谊,126,Malaysia
槟州象棋公会,Persatuan Catur China Pulau Pinang,Penang Chinese Chess Association,"88-3-5, Lintang Sg. Pinang, 10150 Pulau Pinang.",Penang,体育联谊,126,Malaysia
槟州太极气功协会,Persatuan Taiji Qigong LiTek Seah,C/o Chinese Recreation Club Penang,"Jalan Padang Victoria, 10400 Pulau Pinang",Penang,体育联谊,126,Malaysia
槟榔屿中青音乐社,Persatuan Muzika Chung Ching Pulau Pinang,,"13,1st Floor, Jalan Kek Chuah, 10400 Penang.",Penang,体育联谊,126,Malaysia
槟城周家拳体育总会,Persatuan Seni Mempertahankan Diri Zhou Jia Quan,"Zhen Jia Quan Martial Arts Association, Penang","94, Lorong Hutton, 10050 Pulau Pinang.",Penang,体育联谊,126,Malaysia
槟州大旗鼓公会,Persatuan Chingay Pulau Pinang,Penang Chingay Association,"No.191, Magazine Road, 10300 Penang.",Penang,体育联谊,126,Malaysia
槟城智能气功习练中心,Persatuan Pusat Latihan Zhineng Qi Gong Pulau Pinang,,"22 Jalan Ariffin, Pulau Pinang.",Penang,体育联谊,126,Malaysia
槟城阅书报社,,The Penang Philomathic Union,"C/O 151, Lebuh Carnarvon, 10100 Pulau Pinang.",Penang,体育联谊,126,Malaysia
槟州武术龙狮总会,Persekutuan Persatuan-Persatuan Wushu Tarian Singa Dan Naga Negeri Pulau Pinang,"Wushu, Lion & Dragon Dance Association Penang","C/0 Room 205(2nd Floor) 22, Jalan Masjid Kapitan Keling, 10200 Pulau Pinang.",Penang,体育联谊,126,Malaysia
大山脚阿尔玛华盛园居协,Persatuan Penduduk Penduduk Taman Hwa Seng Alma Bukit Mertajam,,"No.1, Solok Kancil, Taman Hwa Seng Almba, Bukit Mertajam.",Penang,体育联谊,126,Malaysia
建阳公会,,Kien Yang Association,"80-H, Jalan Mount Erskine, Tanjong Tokong Mk-18, 10470 Pulau Pinang.",Penang,体育联谊,127,Malaysia
金灵社,Kim Leng Seah (1954),,"No.335 A, Jalan Perak, Pulau Pinang.",Penang,体育联谊,127,Malaysia
复光体育会,,Fok Kong Health League,"377-A, Jalan Dato Keramat, 10150 Pulau Pinang.",Penang,体育联谊,127,Malaysia
凤田社,Hong Tean Seah,,"No.46, Dato Kramat Road, Pulau Pinang.",Penang,体育联谊,127,Malaysia
极乐互助会,Kek Lok Hor Chor Hoay,,"115-G-14, Kedah Road Complex, Pulau Pinang.",Penang,体育联谊,127,Malaysia
嘉德社,Penang Kah Teck Seah,,"No.22, King Street, Pulau Pinang.",Penang,体育联谊,127,Malaysia
嘉宾俱乐部,Kah Pin Club Penang,,"22 & 24,1st Floor Lebuh King, 10200 Penang.",Penang,体育联谊,127,Malaysia
恩平会馆,Persatuan “ Enping” Pulau Pinang,,"4467, Jalan Telaga Air, Butterworth, Seberang Perai Utara.",Penang,体育联谊,127,Malaysia
大山脚南美园居民协会(1997),Persatuan Renduduk Taman Sri Rambai Bukit Mertajam SPTI1997),,"56, Taman Binjai Tmn. Sri Rambai, 14000 Bukit Mertajam.",Penang,体育联谊,127,Malaysia
大山脚香功,Persatuan Senaman Xiang Gong Bukit Mertajam Seberang Perai,,"38, jalan Perpaduan, Taman Alma, 14000 Bukit Mertajam, Seberang Perai, Pulau Pinang.",Penang,体育联谊,127,Malaysia
高渊华人体育会,,Chinese Recreation Club,"1184, Jalan Pintu Sepuluh, 14300 Nibong Tebal, Seberang Perai Selatan, Pulau Pinang.",Penang,体育联谊,127,Malaysia
高渊岭南洪拳体育会,Persatuan Sukan Hong Chyuan,,"1313, Kampung Sanglang, 14300 Nibong Tebal, Seberang Perai Selatan, Pulau Pinang.",Penang,体育联谊,127,Malaysia
美湖朱家中家拳体育及文化协会,Persatuan Kebudayaan & Sukan Choo Kar Chong Kar KuanGertak Sanggul,,"337, Mk8, Gertak Sanggul, 11910 Pulau Pinang.",Penang,体育联谊,128,Malaysia
七星螳螂国术会,Persatuan Seni Mempertahankan Diri Tang Lang,Penang Tang Lang Martial Arts Society,"464-E, Hill Railway Road, Air Itam 11500 Penang.",Penang,体育联谊,128,Malaysia
马来西亚智能气功联合会,Persatuan Zhineng Qigong Malaysia,,"9, Solok Tembaga 4, 11600 Pulau Pinang.",Penang,体育联谊,128,Malaysia
明心社,Min Sin Seah,,"C/0 6, Tingkat Batu Uban 2,11700 Penang.",Penang,体育联谊,128,Malaysia
青华俱乐部,,Cheng Wah Club,"90, Jalan Kedah, 10050 Pulau Pinang.",Penang,体育联谊,128,Malaysia
气功智能科学会,Persatuan Qigong Zhineng Kexue,,"22, Jalan Ariffin, 10050 Pulau Pinang.",Penang,体育联谊,128,Malaysia
兰亭阁俱乐部,,Lan Teng Kok Club,"25, Jalan Sri Bahari, 10050 Pulau Pinang.",Penang,体育联谊,128,Malaysia
丽泽社,Li Tek Seah,Li Tek Seah,"152, Lebuh Carnarvon, 10100 Pulau Pinang.",Penang,体育联谊,128,Malaysia
警顽联友社,Persatuan Persahabatan King Wan,King Wan Association,"85, Lebuh Muntri, 10200 Pulau Pinang.",Penang,体育联谊,128,Malaysia
聚贤俱乐部,Kelab Choi Yin,,"41, Lebuh Muntri, 10200 Pulau Pinang.",Penang,体育联谊,128,Malaysia
清和社,Cheng Hoe Seah,,"No.57, Armenian Street, Pulau Pinang.",Penang,体育联谊,128,Malaysia
马来西亚华人足球公会,,Malaysian Chinese Football Association,"49-C Weld Quay, Pulau Pinang.",Penang,体育联谊,128,Malaysia
阮氏太极体育会,Persatuan Kebudayaan Jasmani Wan Tai Chi,,"2-Z, Lrg Delima 12 Island Glades, 11700 Pulau Pinang.",Penang,体育联谊,129,Malaysia
少怀山健身社,,Seow Hay San Health Culture Association,"1, Jalan Gunaratana, 10460 Pulau Pinang.",Penang,体育联谊,129,Malaysia
少明山健身社,Persatuan Jasmani Sao Beng Sun,,"8-3-16, Lintang Sungai Pinang, Sri Wonder, 10150 Pulau Pinang,",Penang,体育联谊,129,Malaysia
小兰亭俱乐部,,Chinese Marchants' Club,"31-A-B-C, Jalan Abu Siti, 10400 Pulau Pinang.",Penang,体育联谊,129,Malaysia
少林国术健身社,Persatuan Seni Menpertahankan Diri Sao Lim Pinang,Penang Sao Lim Athletic Association,"42, Lebuh Muntri, 10200 Pulau Pinang.",Penang,体育联谊,129,Malaysia
雅韵歌咏队,,Yayin Singing Centre,"Blook 123-1-3, Wisma KGN ,Pengkalan Weld, 10300 Pulau Pinang.",Penang,体育联谊,129,Malaysia
同庆社,Tong Kheng Seah Penang,,"57 Armenian Street, Pulau Pinang.",Penang,体育联谊,129,Malaysia
威北太极体育会,Persatuan Olahraga Taiji Seberang Perai Utara,,"4863, Jalan Sg. Nyior, Butterwoth, Pulau Pinang.",Penang,体育联谊,129,Malaysia
威北本那牙顺兴社,Soon Heng Seah Penaga Butterworth Province Wellesley,,"No.614, Jalan Bertam, Kepala Batas, Seberang Perai Utara, Pulau Pinang.",Penang,体育联谊,129,Malaysia
威省少林武术馆,Persatuan Seni Mempertahankan Diri Sao Um Seberang Perai,,"35, Jalan Bukit Kecil Taman Bukit, 14000 Bukit Mertajam, Pulau Pinang.",Penang,体育联谊,129,Malaysia
威中象棋公会,Persatuan Xiang Qi Daerah Seberang Perai Tengah Pulau Pinang,,"No.16, Lorong Gasing Satu, Taman Berapit Bukit Mertajam, Pulau Pinang.",Penang,体育联谊,129,Malaysia
威南太极体育会,Persatuan Olahraga Taiji Seberang Perai Selatan,,"No.1281, Main Road, Sungai Bakap, Seberang Perai Selatan, Pulau Pinang.",Penang,体育联谊,129,Malaysia
中华游泳公会,,Chinese Swimming Club,"562, Tanjong Bungah, 11200 Pulau Pinang.",Penang,体育联谊,130,Malaysia
亚依淡新市镇居民协会,Persatuan Penduduk-Penduduk Bandar Baru Ayer Itam,,"32-C, Medan Angsana Dua, Bandar Baru Air Itam, 11500 Pulau Pinang.",Penang,体育联谊,130,Malaysia
岳飞国术会,Kelab Seni Mempertahanan Diri Yueh Fei,,"14, Tingkat Erskine Satu, 10470 Pulau Pinang.",Penang,体育联谊,130,Malaysia
夜莺文娱社,,Nightingale Melodians (1959),"91-1, Jalan Air Itam, 10400 Pulau Pinang.",Penang,体育联谊,130,Malaysia
怡然亭俱乐部,,The Corner Club,"55, Gurney Drive, 10250 Penang.",Penang,体育联谊,130,Malaysia
中华体育会,,Chinese Recreation Club,"3, Jalan Padang Victoria, 10400 Pulau Pinang.",Penang,体育联谊,130,Malaysia
锤灵童子军协会,Persatuan Bekas Pengakap Chung Ling Pulau Pinang,,"No.46, Anson Road, Pulau Pinang.",Penang,体育联谊,130,Malaysia
振华(洪家)体育馆,,Chan Wah (Hong Chia) Athletic Association,"70-C, Irving Road, 10400 Pulau Pinang.",Penang,体育联谊,130,Malaysia
益群俱乐部,Kelab Yik Khuen,Yik Khuen Club,"32, Jalan Rangoon, 10400 Pulau Pinang.",Penang,体育联谊,130,Malaysia
以文阁俱乐部,,It Ban Kok Club,"90, Lorong Hutton, 10050 Pulau Pinang.",Penang,体育联谊,130,Malaysia
中央胶带体育会,Kelab Rekreasi Central Elasti,Central Elastic Recreation Club,"Lot 56-61, Perai Industrial Complex, Peral Butterworth.",Penang,体育联谊,130,Malaysia
忠兴社,Choong Heng Seah,,"7, Sungai Dua, 13800 P. W. N.",Penang,体育联谊,130,Malaysia
槟城联合福建公冢,,United Hokkien Cemeteries,"161, Jalan Batu Gantong, 10450 Penang.",Penang,慈善福利,131,Malaysia
槟城道院@世界红卍字会槟城分会,,Penang Tao Yuan @The World Red Swastika Society (Penang Branch),"413, Jalan Masjid Negeri (Green Lane), 11600 Penang.",Penang,慈善福利,131,Malaysia
槟城精武体育会福利部,,Penang Chinese Chin Woo Athletic Association Provident Fund,"No.180-A, Burmah Road, Pulau Pinang.",Penang,慈善福利,131,Malaysia
槟城救护员协会,,Penang Emergency Helper Association,"145, Jalan Dato Kramat, 10150 Pulau Pinang.",Penang,慈善福利,131,Malaysia
陈氏校友会附设互助部,,Benefit Fund Section Of The Tan Si Chool Unio(1954),"No.28, Seh Tan Court, Pulau Pinang.",Penang,慈善福利,131,Malaysia
槟州中华总商会慈善基金委员会,Jawatankuasa Tabong Dermawan Dewan Perniagaan Tiong Hua Pulau Pinang,,"9th Floor, The PG Chinese Town Hall Building, 22, Jalan Pitt, Pulau Pinang.",Penang,慈善福利,131,Malaysia
白云山广东公冢,,Kwang Tung & Teng Chew Association Penang,"50, Lebuh Penang, 10200 Penang.",Penang,慈善福利,131,Malaysia
槟城华人一善堂,,The Chinese Provident Association,"6-B, Jalan Pantai, 10300 Pulau Pinang.",Penang,慈善福利,131,Malaysia
北海王春天律华人义山管委会,Persatuan Pengurusan Tanah Perkuburan Cina-Heng Chong Tian Butterworth,,"1212, Jalan Heng Choon Tian, Butterworth.",Penang,慈善福利,131,Malaysia
槟城北海王春添律后芭福德祠华人公冢理事会,J/K Pengurusan Tanah Perkuburan Orang-Orang Awam Cina,,"Jalan Heng Choon Tian, 12000 Butterworth.",Penang,慈善福利,131,Malaysia
北海及峇东埔广东公冢理事会,Jawatankuasa Pengurusan Perkuburan Kwang Tung Permatang Pauh Dan Butterworth,,"951 Mk.2, Jalan Sama Gagah, Permatang Pauh, Pulau Pinang.",Penang,慈善福利,131,Malaysia
浮罗福建公冢,Persatuan Hokkien Balik Pulau,,"C/0 Choon San Temple, Batu Itam, 11000 Balik Pulau, Penang. 257 B, MK 1, Pantiaches, 11010 Balik Pulau, Penang.",Penang,慈善福利,132,Malaysia
浮罗区华人公冢,,The Balik Pulau Chinese Cemetery Association Penang,"Pokok Manggis Cemetery SHBD, Mk4, Lot 273, Balik Pulau, Penang.",Penang,慈善福利,132,Malaysia
德教会紫云阁福利基金,Yayasan Pertubuhan Pendidikan Akhlak Che Hoon Khor Pulau Pinang,,"No.360, Macalister Road, Pulau Pinang.",Penang,慈善福利,132,Malaysia
崔耀才教育基金委员会,Yayasan Pelajaran Kenangan C.Y.Choy,The C.Y.Choy Memorial Education Fund Committee,"39-A Jalan Irrawadi, 10050 Pulau Pinang.",Penang,慈善福利,132,Malaysia
浮罗华人公冢理事会,,Balik Pulau Chinese Cemetry Association,"44, Sungai Pinang, 10150 Pulau Pinang.",Penang,慈善福利,132,Malaysia
丹斯里苏承球纪念基金,Jawatankuasa Pengurus Kumpulan Wang Peringkatan Tan Sri Saw Seng Kew D/A Chin Kang Hoay Kuan,,"120 Macalister Road, Pulau Pinang.",Penang,慈善福利,132,Malaysia
海客园邱公司公冢,,,"18,Canno Square, 10200 Penang.",Penang,慈善福利,132,Malaysia
浮罗广东公冢,,Kwant Tung & Teng Chew Association Penang,"50, Lebuh Penang, 10200 Penang.",Penang,慈善福利,132,Malaysia
广东公冢理事会,Kwang Tung Cemetery Permatang Pauh,,"951 Mk-2, Jalan Sama Gaga, Permatang Pauh, 13500 P.W..",Penang,慈善福利,132,Malaysia
高巴三万福建公冢,"Tanah PerkuburanKubang Semang, Bukit Mertajam",,"MK.20, Seberang Perai Tengah, Lot.365, 366, 367, 370, 371, 372, 373 & 955.",Penang,慈善福利,132,Malaysia
大山脚韩江公会第二公冢,,,"215, Jalan Ooh Chooi Cheng 14000 Bukit Mertajam.",Penang,慈善福利,132,Malaysia
大山脚广惠肇会馆互助金,,Kwong Waai Siew Association Mutual Benefit Fund Bukit Mertajam Province Wellesly,"No.16 Jalan Stesyen, Bukit Mertajam, Pulau Pinang.",Penang,慈善福利,132,Malaysia
联合福建公冢,Perkuburan Hokkien Bersatu,United Hokkien Cemeteries,"161, Jalan Batu Gantong, 10450 Penang.",Penang,慈善福利,133,Malaysia
峇都兰章福建公冢（槟榔屿联合福建公冢）,,United Hokkien Cemetry Penang,"Jalan Batu Gantong, 10450 Penang.",Penang,慈善福利,133,Malaysia
峇都眼东福建公冢（槟榔屿联合福建公冢）,,United Hokkien Cemetry Penang,"Jalan Batu Gantong, 10450 Penang.",Penang,慈善福利,133,Malaysia
栳栲店福建公冢（槟榔屿联合福建公冢）,,United Hokkien Cemetry Penang,"Jalan Batu Gantong, 10450 Penang.",Penang,慈善福利,133,Malaysia
垄尾福建公冢（槟榔屿联合福建公冢）,,UNITED HOKKIEN CEMETRY PENANG,"Jalan Batu Gantong, 10450 Penang.",Penang,慈善福利,133,Malaysia
华岩寺善後会,,Huah Giam Temple Provident Fund Penang,"46, Dato Kramat Road, Pulau Pinang.",Penang,慈善福利,133,Malaysia
惠南同乡会福利金,Provident Fund Department Of Hooi Lam Lian Heong Hoay,,"No.46, Presgrave Street Pulau Pinang.",Penang,慈善福利,133,Malaysia
峇东埔广东公冢园山仔陈公司,,,"18, Jalan Kg. Raya, 12200 Butterworth.",Penang,慈善福利,133,Malaysia
峇东新托福建龙福公冢,Persatuan Tanah Perkuburan Cina Hokkien Leng Hock,,"12, Tingkat Bertam Dua, Kepala Batas, Seberang Prai Utara, Pulau Pinang.",Penang,慈善福利,133,Malaysia
韩江公冢,,,"215, Jalan Ooh Chooi Cheng, 14000 Bukit Mertajam.",Penang,慈善福利,133,Malaysia
刘关张赵公冢,Persatuan Koo Seah Hoay Daerah,,"1417-1418, Jalan Station, 14200 Sugei Bakap, Seberang Perai Selatan, Pulau Pinang.",Penang,慈善福利,133,Malaysia
湖内华人义山,,,,Penang,慈善福利,133,Malaysia
美湖水长华人义山理事会,Jawatankuasa Pengurusan Tanah Perkuburan Orang-Orang Awam Cina Gertak Sanggul Dan Bukit Gemuruh,,"C/O 766, MK 8, Gertak Sanggul 11910 Bayan Lepas, Pulau Pinang.",Penang,慈善福利,134,Malaysia
南洋同奉善堂槟城分会,Nanyang Thong Hong Siang Tong Penang Chapter,,"31-E, Mk-13, Jalan Zoo, 11500 Pulau Pinang",Penang,慈善福利,134,Malaysia
三清慈爱福利会,Pertubuhan Kebajikan PrihatinSam Cheng,Sam Cheng Everloving Care Welfare Society,"288C-2-12, Fourtune Courth, Jalan Thean Teik, 11500 Air Itam, Penang",Penang,慈善福利,134,Malaysia
什公司华人义山,,"The Chinese Public Cemetery Sepuluh Kongsi, Penang","c/o. 17, Lorong Mahsuri 7, Bayan Baru, 11950 Pulau Pinang.",Penang,慈善福利,134,Malaysia
世界红卍字会槟城分会慈业基金会,Yayasan Kedermawanan Pertubuhan Swastika Merah Dunia Pulau Pinang,The Penang World Red Swastika Society Charity Foundation,"413, Jalan Masjid Negeri (Green Lane), 11600 Penang.",Penang,慈善福利,134,Malaysia
世界红卍字会马来西亚总会,Persatuan Swastika Merah Se-Dunia Malaysia,Malaysia World Red Swastika Society,"413, Jalan Masjid Negeri (Green Lane), 11600 Penang.",Penang,慈善福利,134,Malaysia
马来西亚佛教发展基金会,Yayasan Bella Buddhist Malaysia,,"129, Jalan Seang Tek, 10400 Pulau Pinang.",Penang,慈善福利,134,Malaysia
普爱学园,Persatuan Kebajikan Komuniti Pu Ai,Pu Ai Community Service Centre,"99, (Foreshore) Jalan C.Y.Choy, 10300 Pulau Pinang.",Penang,慈善福利,134,Malaysia
世界红卍字会北海分会,,The World Red Swastika Society Butterworth,"26, Tingkat Kampung Bengali, 12200 Butterworth.",Penang,慈善福利,134,Malaysia
双溪浮油华人义山,,,"3887, Kg. Simpah, 13400 Butterworth, Penang.",Penang,慈善福利,134,Malaysia
双溪浮油义务消防队,Persatuan Bomba Sukarela Sg. Puyu Butterworth,,"No.263, Jalan Besar, Sg.Puyu, Butterworth.",Penang,慈善福利,134,Malaysia
芒加山公冢,,,"2178, Jalan Tengah, Kg. Jawi, 14200 Pulau Pinang.",Penang,慈善福利,134,Malaysia
王景城教育基金委员会,,Mr.Ong Keng Seng Memorial Education Fund Committee,"22 Malay Street, Pulau Pinang.",Penang,慈善福利,135,Malaysia
同善互助会,,Tong Sian Provident Fund,"No.46, Dato Kramat Road, Pulau Pinang.",Penang,慈善福利,135,Malaysia
顺徳(1954)基金会,,The Soon Tuck (1954) Provident Society,"51 Love Lane, Pulau Pinang.",Penang,慈善福利,135,Malaysia
威省北海暨峇东埔广东公冢理事会,,PW & Permatang Pauh Kwang Tung Cemetry Committee,"951, MK 2 , Jalan Samagaga, 13500 Permatang Pauh, Pulau Pinang.",Penang,慈善福利,135,Malaysia
威省巴东新庄福建龙福义山,Persatuan Tanah Perkuburan China Hokkien Leng Hock,,"12, Tingkat Bertam Dua, 13200 Kepala Batas, Seberang Perai, Pulau Pinang.",Penang,慈善福利,135,Malaysia
威省慈善组织联谊总会,Persatuan Kebajikan Dan Ihsan Seberang Prai,,"3047, Pusat Perniagaan Maju, 14000 Bukit Mertajam, Pulau Pinang.",Penang,慈善福利,135,Malaysia
威省刘关张赵古城会华人义山,Kubur Cina Persatuan Lau Kwan Teoh Koo Siang Wool Seberang Perai,,"1772, Jalan Kulim, 14000 Bukit Mertajam, Pulau Pinang.",Penang,慈善福利,135,Malaysia
威省武吉淡汶华人新公冢理事会,,"The Management Committee, New Chinese Cem­etery, Bukit Tambun, P.W.","No.44, Jalan Tasek, 14100 Simpang Ampat, Seberang Perai Selatan, Pulau Pinang.",Penang,慈善福利,135,Malaysia
宋万庆教育基金会,Lembaga Tabung Pendidikan Song Ban Kheng,,"138-C, Jalan Mawar, Off Jalan Kulim, 14000 Bukit Mertajam",Penang,慈善福利,135,Malaysia
威南华人义山协会,Persatuan Perkuburan Cina Seberang Perai Selatan,,"797, Badak Mati, 14200 Sungai Bakap, Pulau Pinang.",Penang,慈善福利,135,Malaysia
威南爪夷公冢,"Rumah Berhala Hock Teik See,Sungei Bakap,",,"Jalan Badak Mali, 14200 Sungai Bakap, Seberang Perai Selatan/ Pulau Pinang.",Penang,慈善福利,135,Malaysia
