Name_CH,Name_ML,Name_EN,Location,Region,Category,PageNumber,Country
兴楼华人义山亭理事会,Persatuan Perkuburan Cina Endau Johor,,"Rumah Berhala Tian Hou Kong, Jalan Haji Arrifin, 86900 Endau, Johor.",Johor,慈善福利,322,Malaysia
兴楼自愿消防队,Persatuan Bomba Sukarela Kawasan Endau Mersing Johor,,"No. 1716, Jalan Jemaluang, Taman Seri Mersing, 86800 Mersing, Johor",Johor,慈善福利,322,Malaysia
青年团结运动答株县会,Persatuan Gerakan Belia Bersatu Batu Pahat Johor,,"13A, Jalan Pantai Baru1, Taman Pantai Baru,83000 Batu Pahat Johor.",Johor,青年妇女,323,Malaysia
巴力拉惹青年促进会,Persatuan Belia Tenaga Mumi Parit Raja Batu Pahat,,"D/A Majlis Tempatan Parit Raja, 86400 Batu Pahat, Johor.",Johor,青年妇女,323,Malaysia
加亨亲善青年会,Persatuan Belia Muhibbah Kahang,,"P87, Kahang , 86700 Kahang, Johor.",Johor,青年妇女,323,Malaysia
小哥打青年俱乐部,Kelab Belia Kota Kecil,,"147A, Jalan Moi Hiang, Kota Kecil, 81900 Kota Tinggl Johor.",Johor,青年妇女,323,Malaysia
话望生广东会馆,Persatuan Kwang Tung Gua Musang,,"143 Tepi Sungai Ketil Gua Musang, 18300 Kelantan. ",Kelantan,地缘,324,Malaysia
吉兰丹道北华人联合会 ,Persatuan Cina Tumpat,,"310-311, Jalan Besar, 16200 Tumpat Kelantan.",Kelantan,综合,324,Malaysia
吉赖客家公会,,Hakka Community Association,"200-201 Jalan Ah Sang, 18000 Kuala Krai, Kelantan. ",Kelantan,地缘,324,Malaysia
吉兰丹华人钓鱼公会,Persatuan Peminat Memancing Cina (Hua Ren) Kelantan,,"Lot No.337, Kg. Bakat 18500 Machang, Kelantan.",Kelantan,地缘,324,Malaysia
吉兰丹广东会馆 ,Persatuan Kwang Tung Kelantan ,Kelantan Kwang lung Association,"A-2, Jalan Pasar Lama, 15000 Kota Bharu, Kelantan. ",Kelantan,地缘,324,Malaysia
吉兰丹海南会馆,Persatuan Hainan Kelantan,,"3930-3931 Jalan Sultanah Zainab, 15050 Kota Bharu, Kelantan.",Kelantan,地缘,324,Malaysia
吉兰丹福建会馆,Persatuan Hokkien Kelantan (Hokkien Hoay Kuan Kelantan ),,"5444 A & B， Tingkat 4, Jalan Sultanah Zainab, 15000 Kota Bharu, Kelantan. ",Kelantan,地缘,324,Malaysia
哥打峇鲁客家公会,Persatuan Hakka Kota Bharu Kelantan,,"3512-F, Tingkat 2, Jalan Sultanah Zainab, Kg. Sireh, 15050 Kota Bharu, Kelantan. ",Kelantan,地缘,324,Malaysia
吉兰丹潮州会馆,Persatuan Teo Chew Kelantan,,"6000-6002 Jalan Hamzah, 10150 Kota Bharu, Kelantan. ",Kelantan,地缘,324,Malaysia
吉兰丹中华大会堂,Gabungan Pertubuhan Tiong Hwa Kelantan,The Federation Of Chinese Associations Of Kelantan,"5429, Jalan Kebun Sultan, 15350 Kota Bahru, Kelantan. ",Kelantan,综合,324,Malaysia
吉兰丹巴西马中华商会 ,Dewan Perniagaan Tiong Hua Pasir Mas Kelantan,,"Bangunan MCA, Tingkat 1-E,  Jalan Masjid Lama, Pasir Mas, Kelantan. | ",Kelantan,业缘,325,Malaysia
话望生中华商会,Dewan Perniagaan China Gua Musang ,Chinese Chanber Of Commerce Gua Musang,"16, Jalan Besar, 18300 Gua Musang, Kelantan.",Kelantan,业缘,325,Malaysia
吉兰丹土生华裔协会 , Persatuan Peranakan Cina Kelantan Dewan Orang Ramai Wat Pracaciparam,,"Kg. Kulim, 16250 Wakaf Bharu, Kelantan.",Kelantan,地缘,325,Malaysia
瓜拉吉赖中华商会 ,Dewan Perniagaan China Kuala Krai,Chinese Chamber Of Commerce Kuala Krai,"170 1st Floor, Jalan Ah Sang, 18000 Kuala Krai, Kelantan.",Kelantan,业缘,325,Malaysia
吉兰丹吉赖客属公会,Persatuan Hakka Community Of Kuala Krai Kelantan,Hakka Community Of Kuala Krai,"200-201, Tingkat 1, Jalan Ah Sang, 18000 Kuala Krai, Kelantan.",Kelantan,地缘,325,Malaysia
吉兰丹南安会馆,Persatuan Lam Ann Kelantan,,"Section 9, Lot 699, Tingkat 3, Jalan Tok Hakim, 15000 Kota Bharu, Kelantan. ",Kelantan,地缘,325,Malaysia
吉兰丹兴安会馆 ,Persatuan Shing Ann Kelantan ,Kelantan Shing Ann Association,"2583 Jalan Suara Muda, 15000 Kota Bharu, Kelantan.",Kelantan,地缘,325,Malaysia
永春会馆 ,Persatuan Eng Choon Kelantan ,Kelantan Eng Choon Hoey Kuan,"Eng Choon Huey Kuan, 2818-G, Tingkat 3, Jalan Che Su, 15000 Kota Bharu, Kelantan. ",Kelantan,地缘,325,Malaysia
吉兰丹黄氏公会,Prsatuan Huang Clan Kelantan ,Huang Clan Association Kelantan,"3180-C (2nd Floor), Jalan Sultan Ibrahim, 15050 Kota Bharu, Kelantan.",Kelantan,血缘,325,Malaysia
吉兰丹晋江会馆  ,Persatuan Chin Kang Kelantan,,"390 Tingkat 4 Jalan Pintu Pong, 15000 Kota Bharu, Kelantan. ",Kelantan,地缘,325,Malaysia
兰斗班让中华商会,Dewan Perniagaan China Rantau Panjang ,Chinese Chamber Of Commercer Rantau Panjang,"1510-1511, Taman Rantau Jaya, 17200 Rantau Panjang, Kelantan.",Kelantan,业缘,326,Malaysia
吉兰丹建造商 ,Persatuan Pekerja-Pekerja Pembinaan Kelantan ,Kin Cho Hong Builders Guild,"3653 1st FR Lee Rubber Building, Jalan Tok Hakim, 15000 Kota Bharu, Kelantan. ",Kelantan,业缘,326,Malaysia
吉兰丹华商咖啡公会,Persatuan Pekedai Kopi Cina Kelantan ,Kelantan Chinese Coffee Shop Keepers Association ,"3930-L Jalan Sultanah Zainab Tingkat 1, 15000 Kota Bharu, Kelantan. ",Kelantan,业缘,326,Malaysia
吉兰丹华校教师公会 ,Persotuon Guru-Guru Sekolah Cino Kelantan,,"SJK(C) Chung Hwa/ Jalan Kelochef, 15300 Kota Bahru, Kelantan.",Kelantan,文教,326,Malaysia
吉兰丹华校董教联合会,Persatuan Pengelola Dan Guru-Guru Sekolah Cina Kelantan,Kelantan Chinese School Committees & Teachers' Association,"2531AJalan Padang Garong, 15000 Kota Bharu, Kelantan. ",Kelantan,文教,326,Malaysia
吉兰丹电器商公会 ,"Persatuan Perniaga Peralatan Elektrik Kelantan
",,"2531-A, Jalan Padang Garong, 15000 Kota Bharu, Kelantan. ",Kelantan,业缘,326,Malaysia
"吉兰丹中华工商总会
",Dewan Perniagaan & Penindustrian China Kelantan, Kelantan Chinese Chamber Of Commerce Of Industy,"5429, Jalan Kebun Sultan, 15350 Kota Bharu, Kelantan.
",Kelantan,业缘,326,Malaysia
吉兰丹车商公会 ,"Persatuan Perntagaan Kerera-Kerata Kelantan
",,"2583, Jalan Suara Mudo, 15000 Kota Bahru, Kelantan.
",Kelantan,业缘,326,Malaysia
吉兰丹机器厂商公会 ,Persatuan Industries Fondri Dan Kejuruteraan Kelantan ,Kelantan Foundry & Engineering Industries Association ,"4086-A, Tingkat 2, Jalan Sultan Yahya Petra, 15200 Kota Bharu, Kelantan. ",Kelantan,业缘,326,Malaysia
吉兰丹中华金商公会 ,Persatuan Perniaga Emas Cina Kelantan ,"Kelantan Chinese Gold Merchantis Association
","1-2 Jalan Pasir Lama, 15000 Kota Bharu Kelantan.",Kelantan,业缘,326,Malaysia
吉兰丹酒商公会 ,,The Kelantan Liquor Dealers Association,"PT 692 Block A&B Kawasan Perindustian Pengkalan Chepo Phase 2,16100 Kota Bharu, Kelantan.",Kelantan,业缘,326,Malaysia
慈慧坛 ,Persatuan Pengajian Confucius Kelantan,,"PT 4204 Jalan Panggong, 18000 Kuala Kroi, Kelantan. ",Kelantan,宗教,327,Malaysia
话望生华小校友会 ,Persatuan Murid Murid Tua Sek. Rendah Jenis Kebangsaan Cina Gua Musang Kelantan,,"18300 Gua Musang, Kelantan. ",Kelantan,文教,327,Malaysia
兰都班让启文校友会,Persatuan Murid Tua SRJK(C) Khay Boon Rantau Panjang ,,"950, Jalan Besar, 17200 Rantau Panjang, Pasir Mas, Kelantan.",Kelantan,文教,327,Malaysia
哥打答鲁真佛宗修会 ,Persatuan Penganut Agama Buddha Chen Foh Chong :Kota Bharu Kelantan,,"Lot 1320 Taman Tengku Ahmad Panglima, jalan Wakaf Mek Zainal, Kelantan.",Kelantan,宗教,327,Malaysia
吉兰丹育英校友会,Persatuan Murid Tua Sekolah Yok Eng Pasir Mas Kelantan,,"D/A Tingkat 1 Bangunan Dewan Perniagaan Tiong Hua Lot 886 Jalan Sek Cina, 17000 Pasir Mas, Kelantan.",Kelantan,文教,327,Malaysia
吉赖育才校友会,Persatuan Murid Murid Tua Sek. Ren Jenis Kebangsaan Cina Yuk Chai Kuala Krai Kelantan,,"152, Jalan Ah Sang, 18000 Kuala Krai, Kelantan.",Kelantan,文教,327,Malaysia
吉兰丹中正校友会 ,Persatuan Murid Murid Tua Sek. Chung Cheng Kota Bharu Kelantan,,"2818-G, Tingkat 2, Jalan Che Su, 15000 Kota Bharu, Kelantan. ",Kelantan,文教,327,Malaysia
哥打答鲁圣教会,Persatuan Penganut Agama Konfusima Kota Bharu Kelantan,,"3055-A Jalan Hamzah, 15050 Kota Bharu, Kelantan.",Kelantan,宗教,327,Malaysia
吉兰丹中华校友会 ,"Persatuan Murid Murid Tua Sek. Chung Hwa Kota Bharu 
Kelantan
",,"1441 Tingkat 3 Taman Koperatif TJ Chat jalan Wakaf Mek Zainas, Kota Bharu, Kelantan. ",Kelantan,文教,327,Malaysia
吉兰丹锤灵校友会,Persatuan Alumni Chung Ling Kelantan ,,"5506-C Jalan Sri Maharaja, Tingkat 2, 15000 Kota Bharu, Kelantan. ",Kelantan,文教,327,Malaysia
巴西敦布北帝宫 ,Persatuan Penganut Buddha Pak Tay Keong Kota Bharu Kelantan,,"Lot PT 1857, Pasir Tumboh, 16150 Kota Bharu, Kelantan.
",Kelantan,宗教,327,Malaysia
关帝庙 ,,Persatuan The Committee Of Management Of The Kuan Thai Meow,"49 Jalan Besar Gua Musang Ulu, Kelantan.",Kelantan,宗教,328,Malaysia
吉兰丹东马岸佛教会 ,Persatuan Buddhist Temangan Machang Kelantan ,Temangan Buddhist Society Machang Kelantan,"597, Jalan Besar, Temangan, 18400 Machang, Kelantan.",Kelantan,宗教,328,Malaysia
华佳巴鲁古林暹庙 ,Persatuan Buddha Wakaf Bharu Wat Kampong Kulim Wakaf Bharu Kelantan,,"Wat Kampong Kulim, 16250 Wakaf Bharu, Kelantan.",Kelantan,宗教,328,Malaysia
吉兰丹巴西马佛教会 ,Persatuan Buddha Pasir Mas Kelantan ,,"D/A Tin Hu Keng Chinese Temple 哗 1 Pengkalan, 17000 Pasir Mas, Kelantan.",Kelantan,宗教,328,Malaysia
吉兰丹瓜拉吉赖佛教会,Persatuan Penganut Kuala Krai Kelantan ,Kuala Krai Buddhist Society Kelantan ,"95 Jalan Chin Hwa，18000 Kuala Krai, Kelantan.",Kelantan,宗教,328,Malaysia
吉赖王圣宫 ,Persatuan Penganut Buddha Yit Sin Kong Kuala Krai Kelantan,,"173 Jalan Chin Wah, 18000 Kuala Krai, Kelantan.",Kelantan,宗教,328,Malaysia
吉兰丹巴西富地佛教会 ,Persatuan Buddhist Pasir Puteh Kelantan,,"148 Atas Jalan Sekolah Pasir Puteh, 16800 Kelantan.",Kelantan,宗教,328,Malaysia
吉兰丹潮音寺 ,Pertubuhan Penganut Buddha Tiaw Imm Sea Kota Bharu Kelantan,,"3937-3938 Jalan Tengku Chik 15000 Kota Bharu, Kelantan.",Kelantan,宗教,328,Malaysia
吉兰丹佛教会,Persatuan Buddhist Kelantan,,"3400 B C Jalan Zainal Abidin, Kota Bharu, Kelantan. ",Kelantan,宗教,328,Malaysia
吉兰丹斗母宫九皇大帝,Pertubuhan Tow Boo Keong Kiu Ong Tai Tay Kelantan,,"Lorong Limau Manis Barat, Kampung Limau Manis, 15050, Kota Bharu, Kelantan, Malaysia",Kelantan,宗教,328,Malaysia
吉兰丹德教会紫灵阁 ,Persatuan Pendidikan Akhlak Che Lena Khor Kelantan ,,"6004 Jalan Hamzah, 15050 Kota Bharu, Kelantan.",Kelantan,宗教,328,Malaysia
吉兰丹德教会振心阁 ,Persatuan Pendidik Akhlak Chin Sim Kok Kelantan ,,"6009 Jalan Hamzah, 15050 Kota Bharu, Kelantan.",Kelantan,宗教,328,Malaysia
南英宫,Pertubuhan Penganut Agama Buddha Nang Ying Gong Kota Bharu Kelantan ,,"PT 298 Kampung Cina, 15000 Kota Bharuz Kelantan.",Kelantan,宗教,329,Malaysia
真佛宗话望生护行堂 ,Persatuan Penganut Agama Buddha Dhamma Zheng Fuo Zong Gua Musang Kelantan,,"Tingkat 2 Lot PT 1004(103), Bandar Baru, 18300 Gua Musang, Kelantan.",Kelantan,宗教,329,Malaysia
吉兰丹话望生佛教会,Persatuan Buddha Gua Musang Hulu Kelantan ,,"264 Kampong Baru, 18300 Gua Musang, Kelantan.",Kelantan,宗教,329,Malaysia
玄天庙 ,Pertubuhan Penganut Buddha Hian Thian Tanah Merah Kelantan,,"Kampung Pasir Pinji, 17500 Tanah Merah, Kelantan.",Kelantan,宗教,329,Malaysia
吉兰丹那美拉佛教会,Persatuan Buddhist Tanah Merah Kelantan,,"Lot 1924 Tingkat 4，Jalan Jedok, 17500 Tanah Merah, Kelantan. ",Kelantan,宗教,329,Malaysia
吉兰丹吉赖瑞青禅院,Persatuan Penganut Agama Buddha Guan Yin Si(Rui Qing Chan Yuan),,"70 Jalan Pintas, 18000 Kuala Krai,  Kelantan.",Kelantan,宗教,329,Malaysia
吉兰丹马章佛教会 ,Persatuan Buddist Machang Kelantan,,"Lot PT (B) 7, Jalan Tanjung, 18500 Machang, Kelantan. ",Kelantan,宗教,329,Malaysia
马章观音堂 ,Pertubuhan Penganut Dewi Kuan Inn Bandar Machang Kelantan,,"PT 370 Jalan Bakat, 18500 Machang, Kelantan. ",Kelantan,宗教,329,Malaysia
吉兰丹企业俱乐部 ,Kelab Giap Yee(Giap Yee Club) Kota Bharu Kelantan,,"681-A Tingkat 1 Jalan Che Su, ! 15000 Kota Bharu, Kelantan.",Kelantan,体育联谊,329,Malaysia
吉兰丹陈氏太极拳协会,Persatuan Chenshi Taijiquan Kelantan ,,"365-H Tingkat 3, Jalan Temenggong, 15000 Kota Bharu, Kelantan. ",Kelantan,体育联谊,329,Malaysia
吉兰丹修禅学会 ,Persatuan Meditasi Buddhist Kelantan,,"3599 Jalan Ismail，15000 Kota Bharu, Kelantan.",Kelantan,宗教,329,Malaysia
巴西马本加兰巴都义山 ,Perkuburan Cina Pengkalan Baru,,"Lot 1938, Perkuburan Cina Pengkalan Baru, 17000 Pasir Mos, Kelantan.",Kelantan,慈善福利,330,Malaysia
巴西马华龙义山,Perkuburan Hua Long,," Kg. Bukit Tuku,17000 Pasir Mas, Kelantan.",Kelantan,慈善福利,330,Malaysia
巴西富地华人义山 ,Perkuburan Orang China Pasir Puteh Kelantan,,"Lot 1262,1263,1264 Mukim Pasir Puteh, Daerah Limbunganz Jajahan Pasir Putehz Kelantan. ",Kelantan,慈善福利,330,Malaysia
道北琼州义山,Jercrt China Kheng Chew,,"Lot 460, Bukit Tanah, Daerah Tumpat, Kelantan. ",Kelantan,慈善福利,330,Malaysia
吉兰丹中华体育会 ,Kelab Rekreasi China Kelantan,,"8, Tingkat 1, Jalan Pasar Lama, Kota Bharu. 15000 Kelantan",Kelantan,体育联谊,330,Malaysia
马来西亚象棋总会 ,Perseketuan Catur Cina Malaysia (Persekutuan Xiang Qi Malaysia),,"8, Tingkat 1, Jalan Pasar Lama, Kota Bharu. 15000 Kelantan",Kelantan,体育联谊,330,Malaysia
吉兰丹武术总会,Persatuan Wushu Kelantan ,,"2722 Jalan Tok Hakim, 15000 Kota Bharu, Kelantan,",Kelantan,体育联谊,330,Malaysia
吉兰丹象棋公会 ,Persatuan Catur Cina Kelantan ,Kelantan Chinese Chess Association ,"2525 Jalan Pintu Pong, Kota Bharuz Kelantan. ",Kelantan,体育联谊,330,Malaysia
仁和音乐社,,Jalan Hoe Music Club,"4213-D &3, Tingkat 1, Jalan Kebun Sultan, 15350 Kota Bharu, Kelantan.",Kelantan,体育联谊,330,Malaysia
丹那美拉华人义山,Persatuan Kebajikan& Kematian Kaum Cina Tanah Merah,,"PT 3272, Daerah Kusial, 17500 Tanah Merah, Kelantan. ",Kelantan,慈善福利,330,Malaysia
话望生华人义山 ,Kubur China Gua AAusang Kelantan ,,"200, Kg. Baru, Gua Musang, Kelantan. ",Kelantan,慈善福利,331,Malaysia
东马岸华人义山,Tanah Kubur Cina Temangan,,"143, Jalan Besar, 18400 Temangan, Kelantan.",Kelantan,慈善福利,331,Malaysia
吉兰丹巴西马福利会,Persatuan Faedah Bersama MCA Bahagian Pasir Mas Kelantan ,,"Lot 886 Seksyen 1, Jalan Masjid Lama, 17000 Pasir Mas, Kelantan. ",Kelantan,慈善福利,331,Malaysia
东马岸福利辅助会,Persatuan Khairat Kematian Masyarakat Cina Temangan,,"Jalan Tepi Sungal 18400 Temangan, Kelantan.",Kelantan,慈善福利,331,Malaysia
日那卓华人义山,Persatuan Perkuburan Kg. Jelatok,,"Kg. Jelatok, 17500 Tanah Merah, Kelantan. ",Kelantan,慈善福利,331,Malaysia
吉赖华人义山公会 ,Petubuhon Perkuburan Kaum Cina Kuala Krai,,"168, Jalan Chin Hwa, 18000 Kuala Krai, Kelantan. ",Kelantan,慈善福利,331,Malaysia
广东义山 ,Tanah Kubur Persatuan Kwang Tung Kelantan,,"Lot 1395, Daerah Badang, Mukim Kijang, Kelantan. ",Kelantan,慈善福利,331,Malaysia
甘榜巴西班谊华人福利,Persatuan Kebajikan Kematian Kaum Cina Kg.Tanah Merah Kelantan,,"D/A Rmah To' Kong China, Kg. Pasir Panjil Tanah Merahz Kelantan.",Kelantan,慈善福利,331,Malaysia
沙都华人义山 ,Tanah Kubur Cina Sador,," Kg. Sador, Pantai Senakz :Tawang, Bachok, Kelantan. ",Kelantan,慈善福利,331,Malaysia
登嘉楼甘马仕海南会馆,Persatuan Hainan Kemasek Terengganu,,"8-131(K-31)Ayer Jerneh, 24210 Kemasek, Terenggun",Terengganu,地缘,332,Malaysia
登嘉楼兴安会馆,Persatuan Hin Ann Terengganu,,"6F Tingkat 4＆5, Bangunan Hin Ann, Jalan Air Jernih, 20300 Kuala Terengganu, Terengganu",Terengganu,地缘,332,Malaysia
登嘉楼海南会馆,Persatuan Hainan Terengganu,,"6 Jalan Kata, 20000 Kuala Terengganu, Terengganu",Terengganu,地缘,332,Malaysia
登嘉楼晋江会馆,Persatuan Chin Kang Terengganu,,"138-C Tingkat 1 Jalan Zainal Abidin, 20300 Kuala Terengganu, Terengganu",Terengganu,地缘,332,Malaysia
登嘉楼中华大会堂,Dewan Perhimpunan Tiong Hwa Terngganu,,"44T,Jalan Air Jernih, 20300 Kuala Terngganu, Terengganu",Terengganu,综合,332,Malaysia
登嘉楼潮州会馆,Persatuan Tech Chew Terengganu,,"91＆93, Jalan Banggol, 20100 Kuala Terengganu, Terengganu",Terengganu,地缘,332,Malaysia
登嘉楼广东会馆,Persatuan Kwang Tung Terengganu,Terengganu Kwang Tung Assonciation,"114, Jalan Sultan Ismail, 20200 Kuala Terengganu, Terengganu",Terengganu,地缘,332,Malaysia
登嘉楼福建会馆,Persatuan Hokkien Terngganu,,"104-A＆B Tingkat 2＆3， Jalan Sultan Ismail, 20200 Kuala Terengganu, Terengganu",Terengganu,地缘,332,Malaysia
登嘉楼南安会馆,Persatuan Namann Terengganu,,"235B Ground Floor, Jalan Sulan Zainal Abidin, 20000 Kuala Terengganu, Terengganu",Terengganu,地缘,332,Malaysia
北加海南会馆,Persatuan Hainan Paka,,"421 MMTP Jalan Limbong, Kuala Paka, Paka, Dungun, Terengganu",Terengganu,地缘,332,Malaysia
登嘉楼裁缝公会,Persatuan Tukang Tuang Jahit Terengganu,Terengganu Tailoring Association,"6 Jalan Kata Lama, 20000 Kuala Terengganu, Terengganu",Terengganu,业缘,333,Malaysia
登嘉楼龙岗亲义会,Pers Lung Kong Terengganu,Lung Kong Associatio Terengganu,"145 Jalan Bandar Kualar Terengganu, Terengganu",Terengganu,血缘,333,Malaysia
登嘉楼杜氏贞义祠,Persatuan Toh Si Cheng She Terengganu,,"235-C Tingkat 2, Jalan Kampong Cina, 20100 Kuala Terengganu, Terengganu",Terengganu,血缘,333,Malaysia
龙运海南会馆,Persatuan Hainan Dungun,,"50 Ti1ngkat 1, Jalan Teck Wan, Dungun, Terengganu",Terengganu,地缘,333,Malaysia
甘马挽海南会馆,Persatuan Hainan Kemaman,,"K-323, Tingkat Satu, Wisma Kheng Chew, Jalan Jalar,24000 Kemaman, Terengganu",Terengganu,地缘,333,Malaysia
龙运福建会馆,Persatuan Hokkien Dungun Terengganu,,"K-222 Tingkat 3, Jalan Lim Teck Guan, 23000 Dungun, Terengganu",Terengganu,地缘,333,Malaysia
甘马挽福建会馆,,The Hokkien Association,"K-328, 1st Floor, Jalan Jakar, 24000 Kemaman, Terengganu",Terengganu,地缘,333,Malaysia
甘马挽潮州会馆,,Kemaman Teo Chew Association,"K-97 Jalan Pasar, 24000 Kemaman, Terengganu",Terengganu,地缘,333,Malaysia
甘马挽广东会馆,Persatuan Kwang Tung Kemaman Terengganu,,"K-7334 Tingkat 1, Jalan Jakar,24000 Kemaman, Terengganu",Terengganu,地缘,333,Malaysia
勿述中华工商会,Dewan Perniagaan Dan Perindustrian Cina Kelantan,Kelantan Chinese Chamber,"73, Taman Teratur, 22000 Jerteh,  Besut, Terrengganu.",Terengganu,业缘,334,Malaysia
登嘉楼建筑商,Peratuan Pembinaan Terengganu,Kim Cho Hong Builders Guild Terengganu,"11-J, Tingkat 1-2, Jalan Kata Lama, 20000 Kuala Terengganu, Terengganu",Terengganu,业缘,334,Malaysia
登嘉楼华校教师公会,Persatuan Guru-Guru Cina Terengganu,Terengganu Chinese Teachers Association,"A62, Taman Tasek, Bukit Payung. 21400 Kuala Terengganu, Terengganu.",Terengganu,文教,334,Malaysia
登嘉楼中华工商总会,,Terrengganu Chiense Chamber of Commerce and Industry,"No 15, 2nd floor, Jalan Batas Bahru, 20300 Kuala Terengganu, Terenganu.",Terengganu,业缘,334,Malaysia
登嘉楼锺灵校友会,,Persatuan Alumni Chung Ling Terengganu,"69 Tingkat 3, Jalan Tok Lam, 20100 Kuala Terengganu, Terengganu.",Terengganu,文教,334,Malaysia
登嘉楼酒商公会,,Pers Terengganu Wine And Spirits Dealers Association,"22-B Tingkat 1, Jalan Kg. Dalam, 20100 Kuala Terengganu, Terengganu",Terengganu,业缘,334,Malaysia
龙运工商会,Dewan Perniagaan Dungun,Chinese Chamber of Commerce,"K-217 Jalan Club MCA, 23000 Dungun, Terengganu.",Terengganu,业缘,334,Malaysia
龙运五星新村校友会,,Persatuan Bekas Murid Murid SJKIC)Sin Chone Dungun,"SJK (C) Sin Chine Kg. Batu, 23000 Dungun, Terengganu.",Terengganu,文教,334,Malaysia
登嘉楼华校董联会,,Terengganu Chinese School Committee And Teachers Association,"K 121, Jalan Masjid, 24000 Kemaman, Terengganu.",Terengganu,文教,334,Malaysia
龙运光华校友会,,Kwang Hwa School Old Boys Association Dungun,"Kwang Hwa Jalan Tamb, 23000 Dungun, Terengganu.",Terengganu,文教,334,Malaysia
吉利地中华商会,Dewan Perhimpunan Cina Kerteh Kemaman Terengganu,,"494-1 Kg. Tengah, 24300 Kerteh, Kemaman, Terengganu.",Terengganu,业缘,334,Malaysia
甘马仕佛教会,Persatuan Penganut Agama Buddha Ayer Erneh Kemasek Terengganu,,"K-879 Jerneh, 24210 Kemasek, Terengganu.",Terengganu,宗教,335,Malaysia
甘马挽永安宫,Majlis Yong An Kong Kemaman,Terengganu Tong Kong Yang An Kong,"Lot 240 Jalan Che, Kemaman, Terengganu.",Terengganu,宗教,335,Malaysia
大马日莲本门正宗佛教会,Persatuan Agama Buddha Nichiren Shoshu Terengganu,,"14 Lot 9278, Taman Mewah, Binjai Rendah Dah Jalan Kuala Berang, 21400 Marang, Terengganu.",Terengganu,宗教,335,Malaysia
华佳达拜佛教会,Persatuan Penganut Agama Buddha Wakaf Tapai,Wakaf Tapas Buddhist Association,"234 Taman Istiwa, Jalan Kuala Berang, 21040 Wokaf Tapai, Terengganu.",Terengganu,宗教,335,Malaysia
登嘉楼三保公庙,Jawatankuasa Pengurusan Tokong Sam Kong Jeram Hulu Nerus Kuala Terengganu,,"C/O Dewaan Perhimpunan Tiong Hua, Kuala Tre 15, Tingkat 2, Jalan Baras Baru, Kalar Terengganu, Terengganu.",Terengganu,宗教,335,Malaysia
登嘉楼佛教会,Persatuan Pengganut-Penganut Buddha Terengganu,Terengganu Buddhist Association,"80-81, Jalan Syed Zain, 20300 Kuala Terengganu, Terengganu.",Terengganu,宗教,335,Malaysia
甘榜忠关帝坛,Pers Penyokong Kuil Kwan Tee Than Kampung Tiong Kuala Terengganu,,"171 Kampong Tiong, 20100 Kuala Terengganu, Terengganu.",Terengganu,宗教,335,Malaysia
登嘉楼真佛宗同修会,Persatuan Pengganut Agama Buddha Chan Foh Chong Kuala Terengganu,,"30-C Tingkat 2, Jalan Hiliran, 20300 Kuala Terengganu, Terengganu.",Terengganu,宗教,335,Malaysia
登嘉楼德教会紫乎阁,,Che Hoo Khor Moral Uplifting Society,"37, Jalan Sultan Zainal Abidin, 20000 Kuala Terengganu, Terengganu.",Terengganu,宗教,335,Malaysia
甘马挽威灵坛,"Persatuan Kebajikan Wei Lin Tong Kemaman, Terengganu",,"Lot 3701 Kg. Fikri, 24000 Kemaman, Terengganu.",Terengganu,宗教,335,Malaysia
甘榜挽孔孟圣道,Pers Penyokong Kong Mengs Sheng Dao Terengganu,,"K-85 Tinggkat 1＆2, Jalan Jakar, 24000 Kemaman, Terengganu.",Terengganu,宗教,335,Malaysia
日底佛教会,Persatuan Pengganut Agama Buddha Jerteh Terengganu,,"Lot 158, Tingkat 2, Jalan Pasir Akar, 22000 Jerteh, Terengganu.",Terengganu,宗教,336,Malaysia
南海飞来观音宫,Jawatankuasa Pengurusan Tokong Yuan Yim(Kuan Yim Kong) Kuala Terengganu,,"235-D, Tingkat 1, Jalan Bandar, 20100 Kuala Terengganu, Terengganu.",Terengganu,宗教,336,Malaysia
日底关帝坛,Persatuan Pengganut Buddha Kuan Tay Toa Jerteh Terengganu,,"53 Taman Teratur, 22000 Jerteh, Terengganu.",Terengganu,宗教,336,Malaysia
蒲莱新村水月宫,Persatuan Penganut Agama Buddha Shui Yue Gong Tepoh Kuala Terengganu,,"Lot 5796 Kg. Pulai Baru, 21080 Kuala Terengganu, Terengganu",Terengganu,宗教,336,Malaysia
智莪广译尊王庙,Tokong Kong Teck Choon Ong,Kong Tech Choon Ong Temple,"Kg. Tirok Serada, Kuala Terengganu, Terengganu.",Terengganu,宗教,336,Malaysia
龙运佛教会,Persatuan Penganut Agama Buddha Dungun,,"Rumah Berhala Hong Tien Tiang, Jalan Bijangga Kuala Dungun, 23000 Dungun, Terengganu.",Terengganu,宗教,336,Malaysia
济善坛,Persatuan Penganut Buddha Ci San Tan Terengganu,,"219-A, Lorong 4, Bandar Baru Pulau Kambing, 20300 Kuala Terengganu, Terengganu",Terengganu,宗教,336,Malaysia
济仙坛,Persatuan Penganut Buddha Chee Sian Thang Terengganu,,"88, Jalan Balik, 23000 Kuala Terengganu, Terengganu",Terengganu,宗教,336,Malaysia
五里新村三太子庙,Jawatankuasa Pengurusan Rumah Berhala Sam Thai Tze Kampong Batu 5 Dungun Terengganu,,"Rumah Berhala Sam Thai Tze Kg. Batu 5, 23000 Dungun, Terengganu.",Terengganu,宗教,336,Malaysia
龙运北加佛教会,"Persatuan Penganut-Penganut Buddha Paka, Dungun Terengganu",,"MDD. 1009 Jalan Limbong Paka, 23000 Dungun, Terengganu.",Terengganu,宗教,336,Malaysia
登嘉楼中华体育会,,Terengganu Chinese Recreation Club,"136-2/1 Jalan Air Jernih, 20300 Kuala Terengganu, Terengganu.",Terengganu,体育联谊,337,Malaysia
登嘉楼中华依斯兰教福利协会,Persatuan Kebajikan Islam Tiong Hua Terengganu,,"237-B Tingkat 3, Jalan Sultan Zainal Abidin, 20000 Kuala Terengganu, Terengganu.",Terengganu,慈善福利,337,Malaysia
瓜丁中华足球协会,Persatuan Bolasepak Tiong Hua Bandar Kualar Terengganu,,"61-B Mezzanine Floor, Jalan Tok Lam, 20300 Kuala Terengganu, Terengganu.",Terengganu,体育联谊,337,Malaysia
登嘉楼华人义山公会,Pertubuhan Perkuburan Cina Terengganu,,"59-G, Tingkat 2, Jalan Tok Lam, 20100 Kuala Terengganu, Terengganu.",Terengganu,慈善福利,337,Malaysia
登嘉楼勿述县中华义山公会,Pertubuhan Perkuburan Tiang Hua Daerah Besut Terengganu,,"d/a Wisma MCA Bahagian Besut, Tingkat 3, 59-E, Jalan Besar, 22000 Jerteh, Terengganu.",Terengganu,慈善福利,337,Malaysia
龙运工余俱乐部,Kong Ee Recreation Club Dungun,,"K-217 Jalan Club MCA, 23000 Dungun, Terengganu.",Terengganu,体育联谊,337,Malaysia
甘马挽醒狮团,Kela Tarian Singa Kemaman Terengganu,,"2816 Taman Itafah, Jalan Jakar, 24000 Kemaman, Terengganu.",Terengganu,体育联谊,337,Malaysia
北加中华义山,Pertubuhan Perkuburan Chung Hwa Paka,,"Lot 2700, 1 km, Jalan Santong, 23100 Paka, Terengganu.",Terengganu,慈善福利,337,Malaysia
甘马挽工余俱乐部,Kelab Kemaman Terengganu,,"K-335 Tingkat 1, Jalan Jalar, 24000 Kemaman, Terengganu.",Terengganu,体育联谊,337,Malaysia
登嘉楼雪泥亭义山,Shueh Ni Ting Cemetery,,"No.6, Jalan Kuta, 20000 Kuala Terengganu, Terengganu.",Terengganu,慈善福利,337,Malaysia
武吉光华人义山,Perkuburan Cina Bukit Kuang,,"Lembaga Pengurus SJKC Chukai, 24000 Kemamanm, Terengganu.",Terengganu,慈善福利,338,Malaysia
华加打北华人义山,Perkuburan Tiong Hwa Wakaf Tapai,,"264, Taman Istiwa, Wakaf Tapai, 21040 Marang, Terengganu.",Terengganu,慈善福利,338,Malaysia
